"","created_time","headline","web_url"
"756",2020-02-08,"New Report on 138 Coronavirus Cases Reveals Disturbing Details","https://www.nytimes.com/2020/02/07/health/coronavirus-patients.html"
"757",2020-03-09,"In Egypt, Tourists Torn Between Ancient Temples and Coronavirus Tests","https://www.nytimes.com/2020/03/09/world/middleeast/egypt-coronavirus-tourism.html"
"758",2020-03-26,"Coronavirus Is Idling North Korea’s Ships, Achieving What Sanctions Did Not","https://www.nytimes.com/2020/03/26/video/coronavirus-north-korea.html"
"759",2020-04-15,"C.D.C. Says More Than 9,000 Health Care Workers Have Contracted Coronavirus","https://www.nytimes.com/2020/04/14/health/coronavirus-health-care-workers.html"
"760",2020-04-29,"Florida Moves to Ease Coronavirus Lockdown as Promising Treatment Emerges","https://www.nytimes.com/reuters/2020/04/29/us/29reuters-health-coronavirus-usa.html"
"761",2020-02-29,"Coronavirus Tests Limits of Central Bank Firepower","https://www.nytimes.com/2020/02/29/business/economy/coronavirus-central-banks-economy.html"
"762",2020-04-27,"Italy, UK Explore Possible COVID-19 Link to Child Inflammatory Disease","https://www.nytimes.com/reuters/2020/04/27/world/europe/27reuters-health-coronavirus-britain-syndrome.html"
"763",2020-04-30,"France's Contact-Tracing App Should Be Ready by End of May-Orange","https://www.nytimes.com/reuters/2020/04/30/technology/30reuters-health-coronavirus-orange-apple.html"
"764",2020-03-03,"China’s Coronavirus Crisis Is Just Beginning","https://www.nytimes.com/2020/03/03/opinion/coronavirus-china-xi-jinping.html"
"765",2020-02-06,"Chinese Doctor, Silenced After Warning of Outbreak, Dies From Coronavirus","https://www.nytimes.com/2020/02/06/world/asia/chinese-doctor-Li-Wenliang-coronavirus.html"
"766",2020-04-30,"What You Need to Know About the Coronavirus Right Now","https://www.nytimes.com/reuters/2020/04/30/world/europe/30reuters-health-coronavirus-snapshot.html"
"767",2020-02-11,"A Store, a Chalet, an Unsealed Pipe: Coronavirus Hot Spots Flare Far From Wuhan","https://www.nytimes.com/2020/02/11/world/asia/china-coronavirus-clusters.html"
"768",2020-04-30,"Why Days 5 to 10 Are So Important When You Have Coronavirus","https://www.nytimes.com/2020/04/30/well/live/coronavirus-days-5-through-10.html"
"769",2020-02-20,"Why the Stock Market Isn’t Too Worried About Coronavirus","https://www.nytimes.com/2020/02/20/upshot/coronavirus-stock-market.html"
"770",2020-04-23,"1 in 5 New Yorkers May Have Had Covid-19, Antibody Tests Suggest","https://www.nytimes.com/2020/04/23/nyregion/coronavirus-antibodies-test-ny.html"
"771",2020-03-12,"No Room at the Inn","https://www.nytimes.com/2020/03/12/well/live/coronavirus-emergency-rooms-hospital-crowding.html"
"772",2020-03-15,"Restrictions on Movement Grow as Governments Try to Slow Coronavirus","https://www.nytimes.com/2020/03/15/world/coronavirus-world-response.html"
"773",2020-03-04,"Trump Makes Room for Experts, but Still Takes a Leading Role on Coronavirus","https://www.nytimes.com/2020/03/03/us/politics/trump-role-coronavirus.html"
"774",2020-04-07,"Coronavirus, Wisconsin, Pandas: Your Tuesday Evening Briefing","https://www.nytimes.com/2020/04/07/briefing/coronavirus-wisconsin-pandas.html"
"775",2020-02-19,"Hundreds Released From Diamond Princess Cruise Ship in Japan","https://www.nytimes.com/2020/02/19/world/asia/japan-cruise-ship-coronavirus.html"
"776",2020-02-08,"The Coronavirus Hits Hong Kong? Quick, Toilet Paper!","https://www.nytimes.com/2020/02/08/opinion/coronavirus-hong-kong.html"
"777",2020-03-10,"God vs. Coronavirus","https://www.nytimes.com/2020/03/10/opinion/coronavirus-church-religion.html"
"778",2020-04-22,"Fear of Coronavirus Haunts Egypt's Cramped Jails","https://www.nytimes.com/reuters/2020/04/22/world/middleeast/22reuters-health-coronavirus-egypt-prisons-insight.html"
"779",2020-04-29,"The Latest: India Touts Gains in Curbing Virus With Lockdown","https://www.nytimes.com/aponline/2020/04/29/business/ap-virus-outbreak-the-latest.html"
"780",2020-04-23,"Your COVID-19 Healthcare Questions, Answered","https://www.nytimes.com/reuters/2020/04/23/business/23reuters-health-coronavirus-q-a.html"
"781",2020-03-08,"For Trump, Coronavirus Proves to Be an Enemy He Can’t Tweet Away","https://www.nytimes.com/2020/03/08/us/politics/trump-coronavirus.html"
"782",2020-04-22,"Recovered, Almost: China's Early Patients Unable to Shed Coronavirus","https://www.nytimes.com/reuters/2020/04/22/world/asia/22reuters-health-coronavirus-china-patients-insight.html"
"783",2020-04-20,"Your Tuesday Briefing","https://www.nytimes.com/2020/04/20/briefing/australia-newzealand-singapore-tokyo-oil.html"
"784",2020-02-16,"Rate of New Fatalities Drops in China","https://www.nytimes.com/2020/02/16/world/asia/china-coronavirus.html"
"785",2020-03-13,"C.D.C.’s Dr. Robert Redfield Confronts Coronavirus, and Anger","https://www.nytimes.com/2020/03/13/health/robert-redfield-cdc-coronavirus.html"
"786",2020-03-18,"Younger Adults Make Up Big Portion of Coronavirus Hospitalizations in U.S.","https://www.nytimes.com/2020/03/18/health/coronavirus-young-people.html"
"787",2020-03-11,"Broadway Usher Tests Positive for Coronavirus","https://www.nytimes.com/2020/03/11/theater/broadway-show-usher-coronavirus.html"
"788",2020-03-27,"The Virus Is Coming to Myanmar, but the Pain Has Already Begun","https://www.nytimes.com/2020/03/27/world/asia/coronavirus-myanmar-jobs-china.html"
"789",2020-03-26,"Coronavirus, Jobless Claims, New Zealand: Your Thursday Briefing","https://www.nytimes.com/2020/03/26/briefing/coronavirus-jobless-claims-new-zealand.html"
"790",2020-04-26,"Italy's Daily Coronavirus Death Toll Lowest Since March 14, New Cases Fall","https://www.nytimes.com/reuters/2020/04/26/world/europe/26reuters-health-coronavirus-italy-tally.html"
"791",2020-04-24,"Italy's Daily Coronavirus Death Toll Lowest Since March 19, but New Cases Rise","https://www.nytimes.com/reuters/2020/04/24/world/europe/24reuters-health-coronavirus-italy-tally.html"
"792",2020-04-28,"Coronavirus Cases in India Climb Towards 30,000; Pakistan Mosques a Growing Worry","https://www.nytimes.com/reuters/2020/04/28/world/asia/28reuters-health-coronavirus-southasia.html"
"793",2020-04-16,"How Democracy Won the World’s First Coronavirus Election","https://www.nytimes.com/2020/04/16/opinion/south-korea-election-coronavirus.html"
"794",2020-03-01,"Coronavirus, India Violence, South Carolina Primary: Your Monday Briefing","https://www.nytimes.com/2020/03/01/briefing/coronavirus-south-korea-india-violence-south-carolina.html"
"795",2020-02-02,"Coronavirus Pummels Wuhan, a City Short of Supplies and Overwhelmed","https://www.nytimes.com/2020/02/02/world/asia/china-coronavirus-wuhan.html"
"796",2020-04-22,"IKEA Opens Half of Stores in Israel After Lockdown Eased","https://www.nytimes.com/reuters/2020/04/22/business/22reuters-health-coronarivus-ikea-israel.html"
"797",2020-03-18,"I’m a Doctor in Italy. We Have Never Seen Anything Like This.","https://www.nytimes.com/2020/03/18/opinion/coronavirus-italy.html"
"798",2020-04-18,"Germany Starts Broad Antibody Testing to Assess Spread of Coronavirus; Israel Relaxes Restrictions","https://www.nytimes.com/2020/04/18/world/coronavirus-cases-tracker.html"
"799",2020-04-23,"Cruise Ship Linked to Australia's Biggest Virus Outbreak Sets Sail","https://www.nytimes.com/reuters/2020/04/23/world/asia/23reuters-health-coronavirus-australia.html"
"800",2020-03-24,"Coronavirus, Olympics, Canned Tomatoes: Your Tuesday Evening Briefing","https://www.nytimes.com/2020/03/24/briefing/coronavirus-olympics-canned-tomatoes.html"
"801",2020-04-25,"British PM Johnson Will Be Back at Work on Monday, Office Says","https://www.nytimes.com/reuters/2020/04/25/world/europe/25reuters-health-coronavirus-britain-johnson.html"
"802",2020-03-26,"Coronavirus, New Orleans, Betty Dodson: Your Thursday Evening Briefing","https://www.nytimes.com/2020/03/26/briefing/coronavirus-new-orleans-betty-dodson.html"
"803",2020-02-20,"As China Fights the Coronavirus, Some Say It Has Gone Too Far","https://www.nytimes.com/2020/02/20/business/economy/china-economy-quarantine.html"
"804",2020-04-24,"Pakistan's Sindh Province Bans Prayer at Mosques During Ramadan","https://www.nytimes.com/reuters/2020/04/24/world/asia/24reuters-health-coronavirus-ramadan-pakistan.html"
"805",2020-04-20,"Istanbul Death Toll Hints Turkey Is Hiding a Wider Coronavirus Calamity","https://www.nytimes.com/2020/04/20/world/middleeast/coronavirus-turkey-deaths.html"
"806",2020-04-03,"A Debate Over Masks Uncovers Deep White House Divisions","https://www.nytimes.com/2020/04/03/us/politics/coronavirus-white-house-face-masks.html"
"807",2020-02-14,"China’s Doctors, Fighting the Coronavirus, Beg for Masks","https://www.nytimes.com/2020/02/14/world/asia/china-coronavirus-doctors.html"
"808",2020-04-11,"‘You Could Lick the Benches’: Life for the First Wave of U.S. Survivors","https://www.nytimes.com/2020/04/11/us/coronavirus-survivors.html"
"809",2020-04-23,"In Texas, a Coastal City Tries to Test Its Way Out of Coronavirus Pandemic","https://www.nytimes.com/reuters/2020/04/23/us/23reuters-health-coronavirus-usa-testing.html"
"810",2020-04-30,"Portugal Relaxes Coronavirus Lockdown With 'Sector-By-Sector' Plan","https://www.nytimes.com/reuters/2020/04/30/world/europe/30reuters-health-coronavirus-portugal.html"
"811",2020-04-08,"Coronavirus and the Cancer Patient","https://www.nytimes.com/2020/04/08/well/live/coronavirus-and-the-cancer-patient.html"
"812",2020-04-22,"Germany Approves Trials of COVID-19 Vaccine Candidate","https://www.nytimes.com/reuters/2020/04/22/world/europe/22reuters-health-coronavirus-vaccine-biontech.html"
"813",2020-04-01,"Global Recession, Coronavirus, Face Masks: Your Thursday Briefing","https://www.nytimes.com/2020/04/01/briefing/coronavirus-global-recession-masks.html"
"814",2020-03-31,"Coronavirus, Spain, New York: Your Tuesday Briefing","https://www.nytimes.com/2020/03/31/briefing/coronavirus-spain-new-york.html"
"815",2020-03-04,"Italy’s Elderly Suffer Heavy Toll as Coronavirus Spreads","https://www.nytimes.com/2020/03/04/world/europe/coronavirus-italy-elderly.html"
"816",2020-03-18,"Coronavirus, New York City, Joe Biden: Your Wednesday Briefing","https://www.nytimes.com/2020/03/18/briefing/coronavirus-new-york-city-joe-biden.html"
"817",2020-04-30,"WHO Says Very Concerned at Community Spread of Coronavirus in West Africa","https://www.nytimes.com/reuters/2020/04/30/world/africa/30reuters-health-coronavirus-africa.html"
"818",2020-03-10,"Coronavirus Turmoil in 5 Charts, 10 Quotes, 5 Photos and 1 Map","https://www.nytimes.com/2020/03/10/business/dealbook/coronavirus-markets-oil.html"
"819",2020-03-19,"Our Infectious Diseases Reporter on the ‘Urgent’ Response to the Coronavirus","https://www.nytimes.com/2020/03/19/reader-center/coronavirus-donald-mcneil.html"
"820",2020-03-25,"Coronavirus, India’s lockdown, Jamal Khashoggi: Your Thursday Briefing","https://www.nytimes.com/2020/03/25/briefing/coronavirus-india-lockdown-jamal-khashoggi.html"
"821",2020-02-26,"Coronavirus, Financial Markets, Emmanuel Macron: Your Wednesday Briefing","https://www.nytimes.com/2020/02/25/briefing/coronavirus-financial-markets-emmanuel-macron.html"
"822",2020-04-29,"Coronavirus Brews Trouble for Tea, Disrupts Supply as Demand Spikes","https://www.nytimes.com/reuters/2020/04/28/world/28reuters-health-coronavirus-tea.html"
"823",2020-03-10,"Can I Boost My Immune System?","https://www.nytimes.com/2020/03/10/well/live/can-i-boost-my-immune-system.html"
"824",2020-03-20,"Photos From a Century of Epidemics","https://www.nytimes.com/2020/03/20/world/europe/coronavirus-aids-spanish-flu-ebola-epidemics.html"
"825",2020-03-23,"How South Korea Flattened the Curve","https://www.nytimes.com/2020/03/23/world/asia/coronavirus-south-korea-flatten-curve.html"
"826",2020-04-13,"Coronavirus, Boris Johnson, Easter Sunday: Your Monday Briefing","https://www.nytimes.com/2020/04/13/briefing/coronavirus-boris-johnson-easter-sunday.html"
"827",2020-03-28,"Rational Panic, but Also Rational Hope","https://www.nytimes.com/2020/03/28/opinion/sunday/coronavirus-masks-cities-response.html"
"828",2020-04-27,"WHO Chief Says Pandemic 'Far From Over', Worried About Children","https://www.nytimes.com/reuters/2020/04/27/world/asia/27reuters-health-coronavirus-who.html"
"829",2020-04-02,"Why Are So Many More Men Dying from Coronavirus?","https://www.nytimes.com/2020/04/02/opinion/coronavirus-men-women.html"
"830",2020-04-24,"Georgia Businesses Reopen Cautiously Amid Coronavirus Worry","https://www.nytimes.com/aponline/2020/04/24/us/ap-us-virus-outbreak-georgia.html"
"831",2020-04-04,"Coronavirus in America: A Highlight Reel","https://www.nytimes.com/2020/04/04/opinion/sunday/coronavirus-america.html"
"832",2020-04-05,"Coronavirus, Masks, Larry David: Your Weekend Briefing","https://www.nytimes.com/2020/04/05/briefing/coronavirus-masks-larry-david.html"
"833",2020-04-13,"When Will Life Be Normal Again? We Just Don’t Know","https://www.nytimes.com/2020/04/13/opinion/coronavirus-what-we-know.html"
"834",2020-04-22,"Hundreds Expected at South Dakota Auto Races Despite Virus","https://www.nytimes.com/aponline/2020/04/22/sports/ap-car-virus-outbreak-auto-races.html"
"835",2020-04-23,"Coronavirus Cruise Ship Finally Leaves Australian Port","https://www.nytimes.com/aponline/2020/04/23/business/ap-as-virus-outbreak-australia.html"
"836",2020-04-20,"Coronavirus, Spain’s Children, Antibodies: Your Monday Briefing","https://www.nytimes.com/2020/04/20/briefing/coronavirus-spain-children-antibodies.html"
"837",2020-04-23,"Coronavirus Briefing: What Happened Today","https://www.nytimes.com/2020/04/22/us/coronavirus-today.html"
"838",2020-03-01,"Second Death From Virus Is Reported in the U.S.","https://www.nytimes.com/2020/03/01/world/coronavirus-news.html"
"839",2020-03-11,"‘It’s Just Everywhere Already’: How Delays in Testing Set Back the U.S. Coronavirus Response","https://www.nytimes.com/2020/03/10/us/coronavirus-testing-delays.html"
"840",2020-04-25,"Belarus Holds Day of Civic Labor Despite Rising Virus Cases","https://www.nytimes.com/aponline/2020/04/25/world/europe/ap-eu-virus-outbreak-belarus-cleanup-day.html"
"841",2020-03-24,"Coronavirus in N.Y.: ‘Astronomical’ Surge Leads to Quarantine Warning","https://www.nytimes.com/2020/03/24/nyregion/coronavirus-new-york-apex-andrew-cuomo.html"
"842",2020-03-26,"Coronavirus Threatens an Already Strained Maternal Health System","https://www.nytimes.com/2020/03/26/us/coronavirus-pregnancy-maternal-health-system.html"
"843",2020-03-11,"How the Coronavirus Is Disrupting Sports Events","https://www.nytimes.com/2020/03/11/sports/coronavirus-sports.html"
"844",2020-03-17,"How Much Does Voting Spread Viruses?","https://www.nytimes.com/2020/03/17/upshot/voting-coronavirus-risk.html"
"845",2020-04-24,"Banned Vienna Protest Against Lockdown Draws 200","https://www.nytimes.com/reuters/2020/04/24/world/europe/24reuters-health-coronavirus-austria-protest.html"
"846",2020-04-23,"U.S. Civil Rights Agency Says Employers Can Test Workers for COVID-19","https://www.nytimes.com/reuters/2020/04/23/us/23reuters-health-coronavirus-usa-work.html"
"847",2020-04-25,"Naval Destroyer USS Kidd Reports Rise in Virus Cases to 33","https://www.nytimes.com/aponline/2020/04/25/us/politics/ap-us-virus-outbreak-kidd.html"
"848",2020-03-06,"Tracking Trump’s Claims on the Threat From Coronavirus","https://www.nytimes.com/2020/03/05/us/politics/trump-coronavirus-fact-check.html"
"849",2020-04-29,"Senate Democrat Says Republican Leader's Plan to Resume Work Puts Lives in Danger","https://www.nytimes.com/reuters/2020/04/29/us/politics/29reuters-health-coronavirus-usa-senate.html"
"850",2020-03-10,"We Don’t Need to Close Schools to Fight the Coronavirus","https://www.nytimes.com/2020/03/10/opinion/coronavirus-school-closing.html"
"851",2020-04-15,"W.H.O., Coronavirus, Boxfish: Your Wednesday Evening Briefing","https://www.nytimes.com/2020/04/15/briefing/who-coronavirus-boxfish-.html"
"852",2020-04-22,"Pakistani Doctors Urge Government to Reimpose Mosque Restrictions","https://www.nytimes.com/reuters/2020/04/22/world/asia/22reuters-health-coronavirus-pakistan.html"
"853",2020-04-10,"Apple and Google Team Up to ‘Contact Trace’ the Coronavirus","https://www.nytimes.com/2020/04/10/technology/apple-google-coronavirus-contact-tracing.html"
"854",2020-02-23,"South Korea Raises Threat Alert Level","https://www.nytimes.com/2020/02/23/world/asia/china-coronavirus.html"
"855",2020-02-23,"As Coronavirus Cases Spiral, South Korea Raises Threat Alert Level","https://www.nytimes.com/2020/02/23/world/asia/south-korea-coronavirus-moon.html"
"856",2020-04-09,"Coronavirus Briefing: What Happened Today","https://www.nytimes.com/2020/04/09/us/coronavirus-today.html"
"857",2020-04-28,"U.S. House Not Returning Next Week, Trump Says Democrats on 'Vacation'","https://www.nytimes.com/reuters/2020/04/28/us/28reuters-health-coronavirus-usa-congress.html"
"858",2020-02-18,"Video Chats and Ordering In: Coronavirus Quarantine With a Smartphone","https://www.nytimes.com/2020/02/18/health/coronavirus-quarantine-smartphone.html"
"859",2020-03-12,"Coronavirus, Tom Hanks, N.B.A.: Your Thursday Briefing","https://www.nytimes.com/2020/03/12/briefing/coronavirus-tom-hanks-nba.html"
"860",2020-03-27,"For France, Coronavirus Tests a Vaunted Health Care System","https://www.nytimes.com/2020/03/27/world/europe/coronavirus-france-health-care.html"
"861",2020-03-04,"House Passes $8.3 Billion Emergency Coronavirus Response Bill","https://www.nytimes.com/2020/03/04/us/politics/coronavirus-emergency-aid-congress.html"
"862",2020-03-17,"Africa Braces for Coronavirus, but Slowly","https://www.nytimes.com/2020/03/17/world/africa/coronavirus-africa-burkina-faso.html"
"863",2020-03-29,"China Created a Fail-Safe System to Track Contagions. It Failed.","https://www.nytimes.com/2020/03/29/world/asia/coronavirus-china.html"
"864",2020-04-23,"We’re Stuck in Coronavirus Limbo","https://www.nytimes.com/2020/04/23/opinion/coronavirus-hope-despair.html"
"865",2020-03-31,"Should I Start Wearing a Mask?","https://www.nytimes.com/article/coronavirus-N95-mask-DIY-face-mask-health.html"
"866",2020-04-27,"The Latest: Tokyo Olympics Unrealistic Without a Vaccine?","https://www.nytimes.com/aponline/2020/04/27/business/bc-virus-outbreak-the-latest.html"
"867",2020-03-23,"Density Is New York City’s Big ‘Enemy’ in the Coronavirus Fight","https://www.nytimes.com/2020/03/23/nyregion/coronavirus-nyc-crowds-density.html"
"868",2020-04-17,"France Weighs Its Love of Liberty in Fight Against Coronavirus","https://www.nytimes.com/2020/04/17/world/europe/coronavirus-france-digital-tracking.html"
"869",2020-02-11,"U.K. Businessman Linked to Coronavirus Cluster Comes Forward","https://www.nytimes.com/2020/02/11/world/europe/coronavirus-britain-steve-walsh.html"
"870",2020-03-16,"Coronavirus Briefing: What Happened Today","https://www.nytimes.com/2020/03/16/us/coronavirus-today.html"
"871",2020-04-27,"Brazil Edges Toward Being Next Big Coronavirus Hot Spot","https://www.nytimes.com/aponline/2020/04/27/business/ap-virus-outbreak.html"
"872",2020-03-31,"Why Jails Are So Important in the Fight Against Coronavirus","https://www.nytimes.com/2020/03/31/upshot/coronavirus-jails-prisons.html"
"873",2020-04-22,"It’s Too Soon to Reopen States. The Coronavirus Is Not Under Control.","https://www.nytimes.com/2020/04/22/opinion/coronavirus-states-reopen.html"
"874",2020-04-27,"To Push Telework, Japan Taking Another Look at Ancient 'Seal' Custom","https://www.nytimes.com/reuters/2020/04/27/world/asia/27reuters-health-coronavirus-japan-seal.html"
"875",2020-04-30,"Coronavirus Lockdown Hits German Jobs, Retail Sales","https://www.nytimes.com/reuters/2020/04/30/world/europe/30reuters-germany-economy-retailsales.html"
"876",2020-03-25,"Citing Virus, Putin Suspends Vote on Keeping Him in Power","https://www.nytimes.com/2020/03/25/world/europe/russia-putin-coronavirus.html"
"877",2020-03-17,"U.A.W. Says Automakers Will Address Coronavirus Concerns at Car Plants","https://www.nytimes.com/2020/03/17/business/coronavirus-autos.html"
"878",2020-04-25,"'I Want My Life Back': Germans Protest Against Lockdown","https://www.nytimes.com/reuters/2020/04/25/world/europe/25reuters-health-coronavirus-germany-protests.html"
"879",2020-02-04,"Hong Kong Reports Its First Coronavirus Death as Outbreak Widens","https://www.nytimes.com/2020/02/04/world/asia/coronavirus-hong-kong-death.html"
"880",2020-03-24,"Coronavirus Is Advancing. All Americans Need to Shelter in Place.","https://www.nytimes.com/2020/03/24/opinion/coronavirus-trump-lockdown.html"
"881",2020-04-28,"Russian Doctors, Nurses Face More Risks as Virus Cases Grow","https://www.nytimes.com/aponline/2020/04/28/world/europe/ap-virus-outbreak-russia-infected-doctors.html"
"882",2020-03-08,"Europe, With Eye on Italy Coronavirus Quarantine, Plans Next Moves","https://www.nytimes.com/2020/03/08/world/europe/coronavirus-europe.html"
"883",2020-03-06,"Top Coronavirus Official for U.S. Has Fought an Epidemic Before","https://www.nytimes.com/2020/03/06/us/politics/coronavirus-trump-deborah-birx.html"
"884",2020-02-18,"In Europe, Fear Spreads Faster Than the Coronavirus Itself","https://www.nytimes.com/2020/02/18/world/europe/coronavirus-stigma-europe.html"
"885",2020-04-22,"US University Tracking Virus' Spread Warns of Layoffs, Cuts","https://www.nytimes.com/aponline/2020/04/22/us/ap-us-virus-outbreak-johns-hopkins-cuts-1st-ld-writethru.html"
"886",2020-04-09,"How to Quit Smoking and Vaping During the Coronavirus Pandemic","https://www.nytimes.com/2020/04/09/health/coronavirus-smoking-vaping-quit.html"
"887",2020-04-29,"Turkey Vows Solidarity With US in Fighting Virus Outbreak","https://www.nytimes.com/aponline/2020/04/29/business/bc-eu-virus-outbreak-turkey-us.html"
"888",2020-04-22,"U.S. Auto Sales Show Signs of Life After Gloomy Coronavirus March: J.D. Power","https://www.nytimes.com/reuters/2020/04/22/business/22reuters-health-coronavirus-usa-autos.html"
"889",2020-04-28,"What You Need to Know Today About the Virus Outbreak","https://www.nytimes.com/aponline/2020/04/28/us/ap-us-virus-outbreak-whats-happening.html"
"890",2020-03-24,"Is This Really the Best Way to Fight Coronavirus?","https://www.nytimes.com/2020/03/24/opinion/coronavirus-economy-social-distancing.html"
"891",2020-04-29,"Michigan to Reopen Construction Industry in State on May 7","https://www.nytimes.com/reuters/2020/04/29/us/29reuters-health-coronavirus-usa-michigan.html"
"892",2020-04-28,"Japan Must Keep State of Emergency, 2021 Olympics 'Difficult,' Top Doctor Says","https://www.nytimes.com/reuters/2020/04/28/sports/olympics/28reuters-health-coronavirus-japan.html"
"893",2020-03-05,"Coronavirus Will Cost Businesses Billions. Insurance May Not Help.","https://www.nytimes.com/2020/03/05/business/coronavirus-business-insurance.html"
"894",2020-04-28,"New York Coronavirus Hospitalizations Drop to Month Low, Governor Says","https://www.nytimes.com/reuters/2020/04/28/us/28reuters-healthcare-coronavirus-usa-new-york.html"
"895",2020-04-28,"Coronavirus, Meat Plants, U.F.O.s: Your Tuesday Evening Briefing","https://www.nytimes.com/2020/04/28/briefing/coronavirus-us-meat-plant-ufo.html"
"896",2020-04-24,"Water Shortage Leaves Poorer Mexicans High and Dry in Coronavirus Fight","https://www.nytimes.com/reuters/2020/04/24/world/americas/24reuters-health-coronavirus-mexico-water.html"
"897",2020-03-12,"In Rare Oval Office Speech, Trump Voices New Concerns and Old Themes","https://www.nytimes.com/2020/03/12/us/politics/trump-coronavirus-address.html"
"898",2020-02-24,"Outbreak in Northern Italy Poses National Challenge","https://www.nytimes.com/2020/02/24/world/asia/china-coronavirus.html"
"899",2020-04-29,"Northern Chinese Region Including Beijing to Ease COVID-19 Curbs","https://www.nytimes.com/reuters/2020/04/29/world/asia/29reuters-health-coronavirus-china-easing.html"
"900",2020-04-25,"We Need Herd Immunity From Trump and the Coronavirus","https://www.nytimes.com/2020/04/25/opinion/coronavirus-immunity-trump.html"
"901",2020-04-23,"Japan Offers Bleakest View of Economy in Over a Decade as Virus Damage Deepens","https://www.nytimes.com/reuters/2020/04/23/world/asia/23reuters-health-coronavirus-japan-economy.html"
"902",2020-04-07,"‘Thanking God for My Breath’: Dispatch From New York’s Frontline","https://www.nytimes.com/2020/04/07/us/female-doctor-coronavirus-frontline.html"
"903",2020-02-12,"New Cases Spike in Hubei Province","https://www.nytimes.com/2020/02/12/world/asia/coronavirus-china-covid-19.html"
"904",2020-02-06,"Wuhan Rounds Up the Infected as Death Toll in China Jumps","https://www.nytimes.com/2020/02/06/world/asia/coronavirus-china.html"
"905",2020-04-21,"China Rattles Sabres as World Battles Coronavirus Pandemic","https://www.nytimes.com/reuters/2020/04/21/world/asia/21reuters-china-security.html"
"906",2020-04-26,"UK Stand-In Leader Declines to Explain Lockdown Exit Strategy","https://www.nytimes.com/reuters/2020/04/26/world/europe/26reuters-health-coronavirus-britain-raab.html"
"907",2020-04-10,"Coronavirus, Testing, Easter: Your Friday Evening Briefing","https://www.nytimes.com/2020/04/10/briefing/coronavirus-testing-easter.html"
"908",2020-02-25,"The Coronavirus Is More Than a Disease. It’s a Test.","https://www.nytimes.com/2020/02/25/opinion/coronavirus-cases-spread.html"
"909",2020-02-22,"Trump Was Furious That Passengers With Coronavirus Were Brought Back to U.S.","https://www.nytimes.com/2020/02/22/us/politics/trump-coronavirus-cruise-ship.html"
"910",2020-04-01,"Coronavirus, New York, Food Banks: Your Wednesday Briefing","https://www.nytimes.com/2020/04/01/briefing/coronavirus-new-york-food-banks.html"
"911",2020-03-05,"Doctors Say U.K. Is Ill Prepared for Coronavirus","https://www.nytimes.com/2020/03/05/world/europe/coronavirus-united-kingdom-national-health-service.html"
