"","created_time","headline","web_url"
"1525",2020-03-19,"Brooklyn Count Soars, as Coronavirus Cases in N.Y.C. Near 4,000","https://www.nytimes.com/2020/03/19/nyregion/coronavirus-new-york-update.html"
"1526",2020-03-26,"How Long Will This Last?","https://www.nytimes.com/2020/03/26/opinion/coronavirus-cases-testing.html"
"1527",2020-04-26,"Hong Kong Police Break Up Pro-Democracy Singing Protest at Mall","https://www.nytimes.com/reuters/2020/04/26/world/asia/26reuters-hongkong-protests.html"
"1528",2020-02-24,"Your Tuesday Briefing","https://www.nytimes.com/2020/02/24/briefing/coronavirus-south-korea-harvey-weinstein.html"
"1529",2020-04-06,"Despite Staggering Death Toll, N.Y. Outbreak Could Be Slowing","https://www.nytimes.com/2020/04/06/nyregion/coronavirus-new-york-curve.html"
"1530",2020-04-09,"Jobless Claims Surpass 16 Million; Aid Package Stalls in Senate","https://www.nytimes.com/2020/04/09/us/coronavirus-us-news.html"
"1531",2020-04-30,"Over 70% of Tested Inmates in Federal Prisons Have COVID-19","https://www.nytimes.com/aponline/2020/04/30/us/politics/ap-us-virus-outbreak-federal-prisons.html"
"1532",2020-04-17,"At Least 14 N.Y. Nursing Homes Have Had More Than 25 Virus Deaths","https://www.nytimes.com/2020/04/17/nyregion/new-york-nursing-homes-coronavirus-deaths.html"
"1533",2020-04-04,"There Is No Way Out but Through","https://www.nytimes.com/2020/04/03/opinion/coronavirus-pandemic.html"
"1534",2020-03-07,"Beware the Deadly Contagion Spread by Blowhards","https://www.nytimes.com/2020/03/07/opinion/sunday/coronavirus-united-states.html"
"1535",2020-04-27,"Georgia Eateries Welcome Diners Back as More U.S. States Ease Pandemic Shutdowns","https://www.nytimes.com/reuters/2020/04/27/us/27reuters-health-coronavirus-usa.html"
"1536",2020-04-09,"Checkpoints, Curfews, Airlifts: Virus Rips Through Navajo Nation","https://www.nytimes.com/2020/04/09/us/coronavirus-navajo-nation.html"
"1537",2020-04-14,"‘We Will All Die One Day,’ My President Said","https://www.nytimes.com/2020/04/14/opinion/coronavirus-bolsonaro-brazil.html"
"1538",2020-04-20,"On Politics: Help for Small Businesses","https://www.nytimes.com/2020/04/20/us/politics/coronavirus-small-business-loans-testing.html"
"1539",2020-03-16,"To Track Coronavirus, Israel Moves to Tap Secret Trove of Cellphone Data","https://www.nytimes.com/2020/03/16/world/middleeast/israel-coronavirus-cellphone-tracking.html"
"1540",2020-04-21,"The Latest: China Reports 30 New Virus Cases, No Deaths","https://www.nytimes.com/aponline/2020/04/21/business/ap-virus-outbreak-the-latest.html"
"1541",2020-03-31,"She’s Alone, 105 and in a Nursing Home Threatened by the Virus","https://www.nytimes.com/2020/03/31/nyregion/coronavirus-nursing-homes-nyc.html"
"1542",2020-04-22,"Covid-19 Trickles Into Haiti: ‘This Monster Is Coming Our Way’","https://www.nytimes.com/2020/04/22/world/americas/coronavirus-haiti.html"
"1543",2020-04-09,"Stark Death Toll, but Cautious Optimism in N.Y. Over Hospitalizations","https://www.nytimes.com/2020/04/09/nyregion/ny-coronavirus-hospitalizations-flattening-the-curve.html"
"1544",2020-03-29,"Trump Extends Social Distancing Guidelines Through End of April","https://www.nytimes.com/2020/03/29/us/politics/trump-coronavirus-guidelines.html"
"1545",2020-04-24,"‘Playing Russian Roulette’: Nursing Homes Told to Take the Infected","https://www.nytimes.com/2020/04/24/us/nursing-homes-coronavirus.html"
"1546",2020-04-02,"12 Fraught Hours With E.M.T.s in a City Under Siege","https://www.nytimes.com/2020/04/01/health/coronavirus-emt-workers.html"
"1547",2020-03-18,"Gov. Andrew Cuomo: ‘It’s Making Sure We Live Through This.’","https://www.nytimes.com/2020/03/18/podcasts/the-daily/cuomo-new-york-coronavirus.html"
"1548",2020-03-27,"Let’s ‘Kick Coronavirus’s Ass’","https://www.nytimes.com/2020/03/27/opinion/sunday/cuomo-new-york-coronavirus.html"
"1549",2020-04-14,"In Pandemic’s Grip, Russia Sees Spike in Age-Old Bane: Drinking","https://www.nytimes.com/2020/04/14/world/europe/russia-coronavirus-alcoholism.html"
"1550",2020-04-08,"Virus Is Twice as Deadly for Black and Latino People Than Whites in N.Y.C.","https://www.nytimes.com/2020/04/08/nyregion/coronavirus-race-deaths.html"
"1551",2020-04-28,"Trump’s Response to Virus Reflects a Long Disregard for Science","https://www.nytimes.com/2020/04/28/climate/trump-coronavirus-climate-science.html"
"1552",2020-04-29,"Over 70% of Tested Inmates in Federal Prisons Have COVID-19","https://www.nytimes.com/aponline/2020/04/29/us/politics/ap-us-virus-outbreak-federal-prisons.html"
"1553",2020-03-30,"For Autocrats, and Others, Coronavirus Is a Chance to Grab Even More Power","https://www.nytimes.com/2020/03/30/world/europe/coronavirus-governments-power.html"
"1554",2020-04-30,"UN Chief: World Should Follow South Korea on COVID-19 Fight","https://www.nytimes.com/aponline/2020/04/30/world/ap-un-virus-outbreak-un-south-korea-example.html"
"1555",2020-04-26,"The Latest: Japan Adds 14 More Countries to Entry Ban List","https://www.nytimes.com/aponline/2020/04/26/business/ap-virus-outbreak-the-latest.html"
"1556",2020-04-30,"Serbia Opposition Stage Curfew Protest Against Government","https://www.nytimes.com/aponline/2020/04/30/world/europe/ap-eu-virus-outbreak-serbia-protest.html"
"1557",2020-04-28,"COVID-19 Testing for Anyone Draws a Crowd in Hard-Hit Detroit","https://www.nytimes.com/reuters/2020/04/28/us/28reuters-health-coronavirus-usa-detroit.html"
"1558",2020-04-22,"Easing of South Africa's Strict Lockdown Will Not Apply to Sport","https://www.nytimes.com/reuters/2020/04/22/sports/rugby/22reuters-health-coronavirus-sport-safrica.html"
"1559",2020-04-12,"I Used to Run the C.D.C. Here’s What It Can Do to Slow This Pandemic.","https://www.nytimes.com/2020/04/12/opinion/cdc-coronavirus.html"
"1560",2020-03-26,"U.S. Now Leads the World in Confirmed Cases","https://www.nytimes.com/2020/03/26/world/coronavirus-news.html"
"1561",2020-04-23,"Iran, Like Wider Mideast, Relies on Deliveries Amid Pandemic","https://www.nytimes.com/aponline/2020/04/23/world/middleeast/ap-ml-virus-outbreak-mideast.html"
"1562",2020-04-29,"Drug Proves Effective Against Virus as Economic Damage Rises","https://www.nytimes.com/aponline/2020/04/29/business/ap-virus-outbreak.html"
"1563",2020-04-02,"In a Pandemic, Do Doctors Still Have a Duty to Treat?","https://www.nytimes.com/2020/04/02/opinion/sunday/coronavirus-doctors-duty.html"
"1564",2020-03-10,"‘Containment Area’ Is Ordered for New Rochelle Coronavirus Cluster","https://www.nytimes.com/2020/03/10/nyregion/coronavirus-new-rochelle-containment-area.html"
"1565",2020-03-28,"Coronavirus Crisis Awakens a Sleeping Giant: China’s Youth","https://www.nytimes.com/2020/03/28/world/asia/coronavirus-china-youth.html"
"1566",2020-04-10,"Did New Yorkers Who Fled to Second Homes Bring the Virus?","https://www.nytimes.com/2020/04/10/nyregion/coronavirus-new-yorkers-leave.html"
"1567",2020-03-31,"Fox’s Fake News Contagion","https://www.nytimes.com/2020/03/31/opinion/coronavirus-fox-news.html"
"1568",2020-04-02,"White House Debates How Far to Go on Face Mask Guidelines","https://www.nytimes.com/2020/04/02/world/coronavirus-live-news-updates.html"
"1569",2020-04-27,"HK Scientists Say New Antiviral Coating Can Protect Surfaces for 90 Days","https://www.nytimes.com/reuters/2020/04/27/world/asia/27reuters-health-coronavirus-hongkong-coating.html"
"1570",2020-04-25,"California Restaurants to Get Public Money for Healthy Meals","https://www.nytimes.com/aponline/2020/04/25/business/ap-us-virus-outbreak-california-subsidized-meals.html"
"1571",2020-04-16,"Trump Says States Can Start Reopening While Acknowledging the Decision Is Theirs","https://www.nytimes.com/2020/04/16/us/politics/coronavirus-trump-guidelines.html"
"1572",2020-04-17,"Concerns of a Coup Stir in Sudan as Capital Braces for a Virus Lockdown","https://www.nytimes.com/2020/04/17/world/africa/Sudan-coup-coronavirus.html"
"1573",2020-04-03,"For Those With O.C.D., a Threat That Is Both Heightened and Familiar","https://www.nytimes.com/2020/04/03/style/ocd-coronavirus-challenges.html"
"1574",2020-04-30,"Valentina Blackhorse, Navajo Pageant Winner With Dreams, Dies at 28","https://www.nytimes.com/2020/04/30/obituaries/valentina-blackhorse-dead-coronavirus.html"
"1575",2020-04-29,"Some Sports May Have to Skip This Year, Fauci Says","https://www.nytimes.com/2020/04/28/sports/fauci-sports-reopening-pandemic.html"
"1576",2020-02-25,"Coronavirus, Harvey Weinstein, Kobe Bryant: Your Tuesday Briefing","https://www.nytimes.com/2020/02/25/briefing/coronavirus-harvey-weinstein-kobe-bryant.html"
"1577",2020-04-09,"Record Virus Deaths for a Second Day","https://www.nytimes.com/2020/04/09/nyregion/coronavirus-nyc.html"
"1578",2020-04-12,"Anti-Muslim Attacks, Boris Johnson, China’s New Cases: Your Monday Briefing","https://www.nytimes.com/2020/04/12/briefing/coronavirus-india-anti-muslim-attacks.html"
"1579",2020-04-22,"The Cold Calculations Governors Will Have to Make Before Reopening","https://www.nytimes.com/2020/04/22/us/politics/coronavirus-reopening-governors-trump.html"
"1580",2020-03-16,"Wondering About Social Distancing?","https://www.nytimes.com/2020/03/16/smarter-living/coronavirus-social-distancing.html"
"1581",2020-04-09,"‘Sea Fever’ Review: A Timely but Derivative Contagion Thriller","https://www.nytimes.com/2020/04/09/movies/sea-fever-review.html"
"1582",2020-04-09,"For 12 Days a Doctor Lived With Burning Lungs","https://www.nytimes.com/2020/04/09/opinion/coronavirus-recovery.html"
"1583",2020-04-28,"Hong Kong Civil Servants to Return to Work as Lockdown Eases","https://www.nytimes.com/reuters/2020/04/28/world/asia/28reuters-health-coronavirus-hongkong.html"
"1584",2020-04-21,"Netherlands Extends Ban on Events, to Allow Some School Openings","https://www.nytimes.com/reuters/2020/04/21/world/europe/21reuters-health-coronavirus-netherlands.html"
"1585",2020-03-17,"‘It’s Like a War’","https://www.nytimes.com/2020/03/17/podcasts/the-daily/italy-coronavirus.html"
"1586",2020-03-17,"Stop Saying That Everything Is Under Control. It Isn’t.","https://www.nytimes.com/2020/03/17/opinion/war-crononavirus-trump-production.html"
"1587",2020-04-27,"How Do You Sign ‘Don’t Drink Bleach’?","https://www.nytimes.com/2020/04/27/us/coronavirus-sign-language-interpreters.html"
"1588",2020-03-30,"N.Y. Hospitals Face $400 Million in Cuts Even as Virus Battle Rages","https://www.nytimes.com/2020/03/30/nyregion/coronavirus-hospitals-medicaid-budget.html"
"1589",2020-04-21,"Despite Scattered Protests, Most Americans Support Shelter-In-Place, Reuters/Ipsos Poll Shows","https://www.nytimes.com/reuters/2020/04/21/us/21reuters-usa-election-poll.html"
"1590",2020-04-24,"Vanquish the Virus? Australia and New Zealand Aim to Show the Way","https://www.nytimes.com/2020/04/24/world/australia/new-zealand-coronavirus.html"
"1591",2020-04-27,"Ohio, Michigan Governors Diverge on Plans to Reopen During Pandemic","https://www.nytimes.com/reuters/2020/04/27/us/27reuters-health-coronavirus-usa-ohio.html"
"1592",2020-03-16,"Trial of Coronavirus Vaccine Made by Moderna Begins in Seattle","https://www.nytimes.com/2020/03/16/health/coronavirus-vaccine.html"
"1593",2020-04-09,"Palestinians Fear a Coming Coronavirus Storm","https://www.nytimes.com/2020/04/09/world/middleeast/coronavirus-palestinians-israel-gaza-west-bank.html"
"1594",2020-02-22,"Trump Makes the American Health Care System Even Worse","https://www.nytimes.com/2020/02/22/opinion/sunday/china-united-states-health.html"
"1595",2020-04-05,"Trump Again Promotes Use of Unproven Anti-Malaria Drug; Deaths in Country May Be Undercounted","https://www.nytimes.com/2020/04/05/world/coronavirus-live-news-updates.html"
"1596",2020-03-26,"Expert Advice: Should ‘Snowbirds’ Stay or Go?","https://www.nytimes.com/2020/03/26/travel/coronavirus-snowbirds-advice.html"
"1597",2020-04-12,"It’s ‘People, People, People’ as Lines Stretch Across America","https://www.nytimes.com/2020/04/12/us/coronavirus-long-lines-america.html"
"1598",2020-04-30,"Park Right of the Jet and Enjoy the Movie: Lockdown Cinema at Empty Airport","https://www.nytimes.com/reuters/2020/04/30/arts/30reuters-health-coronavirus-lithuania.html"
"1599",2020-02-12,"New Hampshire, Roger Stone, Coronavirus: Your Wednesday Briefing","https://www.nytimes.com/2020/02/12/briefing/new-hampshire-roger-stone-coronavirus.html"
"1600",2020-04-17,"When Duty Calls, and Menaces","https://www.nytimes.com/2020/04/17/us/coronavirus-doctors-dilemmas.html"
"1601",2020-04-08,"A Call With Katie Porter: ‘This Is Not a Partisan Crisis’","https://www.nytimes.com/2020/04/08/us/coronavirus-california-rep-katie-porter.html"
"1602",2020-04-27,"Can Estrogen and Other Sex Hormones Help Men Survive Covid-19?","https://www.nytimes.com/2020/04/27/health/coronavirus-estrogen-men.html"
"1603",2020-04-28,"Italy's Prime Minister Defends Snail-Paced End to Lockdown","https://www.nytimes.com/reuters/2020/04/28/world/europe/28reuters-health-coronavirus-italy.html"
"1604",2020-04-02,"After Lost Months, Britain Vows to Catch Up on Virus Testing","https://www.nytimes.com/2020/04/02/world/europe/uk-coronavirus-testing.html"
"1605",2020-04-05,"U.S. Military Seeks More Funding for Pacific Region After Pandemic","https://www.nytimes.com/2020/04/05/us/politics/us-china-military-funding-virus.html"
"1606",2020-03-20,"The Pandemic That Ravaged Canada and Its Lessons for Today","https://www.nytimes.com/2020/03/20/world/canada/Spanish-Flu-1918-Coronavirus.html"
"1607",2020-04-01,"How South Korea Solved Its Face Mask Shortage","https://www.nytimes.com/2020/04/01/opinion/covid-face-mask-shortage.html"
"1608",2020-03-27,"Trump Chooses Disaster as His Re-Election Strategy","https://www.nytimes.com/2020/03/27/opinion/trump-coronavirus-response.html"
"1609",2020-04-16,"Inside the Fringe Japanese Religion That Claims It Can Cure Covid-19","https://www.nytimes.com/article/happy-science-japan-coronavirus-cure.html"
"1610",2020-02-29,"Trump Calls for Calm on Virus and Expands Travel Restrictions","https://www.nytimes.com/2020/02/29/world/coronavirus-news.html"
"1611",2020-04-02,"The Virus Comes for Democracy","https://www.nytimes.com/2020/04/02/opinion/coronavirus-democracy.html"
"1612",2020-03-12,"Halting China’s Economy Was Hard. Restarting It Is Harder.","https://www.nytimes.com/2020/03/12/business/china-coronavirus-economy.html"
"1613",2020-03-18,"When Home Becomes a Classroom","https://www.nytimes.com/2020/03/18/reader-center/coronavirus-online-learning.html"
"1614",2020-04-24,"Honeymoon Over, Spain's Fragile Coalition Tested by Pandemic Politics","https://www.nytimes.com/reuters/2020/04/24/world/europe/24reuters-health-coronavirus-spain-politics.html"
"1615",2020-04-27,"'Still in the Surge': Virus Keeps a Hold on Massachusetts","https://www.nytimes.com/aponline/2020/04/27/us/ap-us-virus-outbreak-anguish-in-massachusetts.html"
"1616",2020-04-27,"Boris Johnson, Back on the Job, Urges Caution in Easing Covid-19 Rules","https://www.nytimes.com/2020/04/27/world/europe/coronavirus-britain-boris-johnson.html"
"1617",2020-04-08,"41 Transit Workers Dead: Crisis Takes Staggering Toll on Subways","https://www.nytimes.com/2020/04/08/nyregion/coronavirus-nyc-mta-subway.html"
"1618",2020-03-25,"Pentagon Takes Restrained Role in Coronavirus Response, Despite Calls for Help","https://www.nytimes.com/2020/03/25/us/politics/coronavirus-pentagon-military.html"
"1619",2020-04-12,"How a Premier U.S. Drug Company Became a Virus ‘Super Spreader’","https://www.nytimes.com/2020/04/12/us/coronavirus-biogen-boston-superspreader.html"
"1620",2020-03-19,"Gratitude in the Face of Crisis","https://www.nytimes.com/2020/03/19/well/live/virus-well-newsletter-gratitude.html"
"1621",2020-04-22,"More U.S. States Make Plans to Reopen; California Holds Firm","https://www.nytimes.com/reuters/2020/04/22/us/politics/22reuters-health-coronavirus-usa.html"
"1622",2020-03-16,"Trump Urges Limits Amid Pandemic, but Stops Short of National Mandates","https://www.nytimes.com/2020/03/16/us/politics/trump-coronavirus-guidelines.html"
"1623",2020-04-25,"Making Marines Without Making Them Sick","https://www.nytimes.com/2020/04/25/magazine/marines-training-coronavirus.html"
"1624",2020-04-13,"The Supply Chain for Food Is Stressed","https://www.nytimes.com/2020/04/13/business/stocks-today-coronavirus.html"
"1625",2020-04-17,"China’s Economy Shrinks, Ending a Nearly Half-Century of Growth","https://www.nytimes.com/2020/04/16/business/china-coronavirus-economy.html"
"1626",2020-03-20,"Gov. Gavin Newsom of California Orders Californians to Stay at Home","https://www.nytimes.com/2020/03/19/us/California-stay-at-home-order-virus.html"
"1627",2020-02-09,"Deaths in China Surpass Toll From SARS","https://www.nytimes.com/2020/02/09/world/asia/coronavirus-china.html"
"1628",2020-03-19,"Amid Virus and Market Tumult, Wall Street Lives a New Reality","https://www.nytimes.com/2020/03/19/business/coronavirus-wall-street.html"
"1629",2020-04-30,"China to Tighten Rules to Stop Movies From Premiering Online: Sources","https://www.nytimes.com/reuters/2020/04/30/arts/30reuters-health-coronavirus-china-film.html"
"1630",2020-03-20,"Can’t Get Tested? Maybe You’re in the Wrong Country","https://www.nytimes.com/2020/03/20/world/europe/coronavirus-testing-world-countries-cities-states.html"
"1631",2020-03-19,"Passengers Fell Ill With Coronavirus. And the Ship Sailed On.","https://www.nytimes.com/2020/03/19/travel/coronavirus-cruise-costa-luminosa.html"
"1632",2020-04-11,"Congo Was Close to Defeating Ebola. Then One More Case Emerged.","https://www.nytimes.com/2020/04/11/world/africa/congo-ebola-coronavirus.html"
"1633",2020-03-26,"We Must Vote in November. This Is How to Ensure That We Can.","https://www.nytimes.com/2020/03/26/opinion/coronavirus-2020-election.html"
"1634",2020-04-21,"Exclusive: Venezuela Socialists, Opposition Leaders Begin Secret Talks Amid Pandemic-Sources","https://www.nytimes.com/reuters/2020/04/21/world/americas/21reuters-health-coronavirus-venezuela-politics-exclusive.html"
"1635",2020-03-24,"Golf Rounds Surged as Coronavirus Advanced. Now the Game Is Retreating.","https://www.nytimes.com/2020/03/24/sports/golf/golf-courses-open-coronavirus.html"
"1636",2020-04-24,"Michigan Governor Lifts Some Restrictions but Extends Shutdown Order","https://www.nytimes.com/reuters/2020/04/24/us/politics/24reuters-health-coronarivus-usa-midwest.html"
"1637",2020-03-27,"A Lucky Country Says Goodbye to the World’s Longest Boom","https://www.nytimes.com/2020/03/27/world/australia/australia-coronavirus-economy.html"
"1638",2020-03-30,"Nurses Die, Doctors Fall Sick and Panic Rises on Virus Front Lines","https://www.nytimes.com/2020/03/30/nyregion/ny-coronavirus-doctors-sick.html"
"1639",2020-03-18,"Will the Olympics Go On? Japan’s Businesses Would Like to Know","https://www.nytimes.com/2020/03/18/business/japan-olympics-coronavirus.html"
"1640",2020-04-05,"He Led a Top Navy Ship. Now He Sits in Quarantine, Fired and Infected.","https://www.nytimes.com/2020/04/05/us/politics/coronavirus-aircraft-carrier-roosevelt-crozier.html"
"1641",2020-04-23,"South Korea Posts Biggest GDP Fall Since 2008 as Pandemic Cripples Demand","https://www.nytimes.com/reuters/2020/04/22/world/asia/22reuters-southkorea-economy-gdp.html"
"1642",2020-04-22,"AP Exclusive: 'It’s Been a Nightmare' for Yonkers ER Doc","https://www.nytimes.com/aponline/2020/04/22/us/ap-us-virus-outbreak-inside-a-new-york-er.html"
"1643",2020-04-28,"Let the Sunshine In","https://www.nytimes.com/2020/04/28/well/live/coronavirus-sunlight-uv-stress-mood-immune-system-vitamin-D.html"
"1644",2020-04-09,"New Spikes in Asia, Boris Johnson, Stimulus Efforts: Your Friday Briefing","https://www.nytimes.com/2020/04/09/briefing/new-cases-in-asia-boris-johnson-and-chinas-hesitation-on-stimulus.html"
"1645",2020-04-29,"A Scramble for Virus Apps That Do No Harm","https://www.nytimes.com/2020/04/29/business/coronavirus-cellphone-apps-contact-tracing.html"
"1646",2020-04-30,"Trump Officials Are Said to Press Spies to Link Virus and Wuhan Labs","https://www.nytimes.com/2020/04/30/us/politics/trump-administration-intelligence-coronavirus-china.html"
"1647",2020-03-14,"Does Coronavirus Mean the End of Sports as We Know Them?","https://www.nytimes.com/2020/03/14/sports/sports-coronavirus-canceled-events.html"
"1648",2020-02-07,"‘Should We Leave?’ Life in China Under Coronavirus Lockdown","https://www.nytimes.com/2020/02/07/opinion/sunday/china-coronavirus.html"
"1649",2020-04-29,"Wall Street Uniform to Get a New Accessory-The Face Mask","https://www.nytimes.com/reuters/2020/04/29/world/europe/29reuters-health-coronavirus-banks-offices.html"
"1650",2020-03-31,"Coronavirus Spreads in Veterans’ Home, Leaving ‘Shuddering Loss for Us All’","https://www.nytimes.com/2020/03/31/us/coronavirus-holyoke-veterans-home.html"
"1651",2020-04-16,"Big Government or Big Hassle?","https://www.nytimes.com/2020/04/16/us/politics/stay-at-home-protests.html"
"1652",2020-03-23,"158 Million Americans Told to Stay Home, but Trump Pledges to Keep It Short","https://www.nytimes.com/2020/03/23/world/coronavirus-updates-usa-world.html"
"1653",2020-04-07,"N.Y. Virus Deaths Hit New High, but Hospitalizations Slow","https://www.nytimes.com/2020/04/07/nyregion/coronavirus-new-york-update.html"
"1654",2020-04-29,"Fitch Cuts Italy's Gov't Debt Grade, Auto Plants Reopening","https://www.nytimes.com/aponline/2020/04/29/business/bc-virus-outbreak-business-fallout.html"
"1655",2020-04-03,"What Happens if Congress Cannot Assemble to Do Its Work?","https://www.nytimes.com/2020/04/03/opinion/coronavirus-congress-voting.html"
"1656",2020-04-29,"Facebook Revenue Growth Slows, but 'Signs of Stability' Rise","https://www.nytimes.com/aponline/2020/04/29/business/ap-us-facebook-results.html"
"1657",2020-04-24,"‘I Like It, Actually’: Why So Many Older People Thrive in Lockdown","https://www.nytimes.com/2020/04/24/nyregion/coronavirus-elders-nyc.html"
"1658",2020-02-17,"How to Stop a Disease From Crossing Borders","https://www.nytimes.com/2020/02/17/travel/traveling-cdc-coronavirus.html"
"1659",2020-04-30,"Navy Hospital Ships, Once Thought Critical, See Few Patients","https://www.nytimes.com/aponline/2020/04/30/us/ap-us-virus-outbreak-hospital-ship-few-patients.html"
"1660",2020-04-18,"‘Something Is Going to Explode’: When Coronavirus Strikes a Prison","https://www.nytimes.com/2020/04/18/magazine/oakdale-federal-prison-coronavirus.html"
"1661",2020-04-03,"‘We Can’t Spend What We Don’t Have’: Virus Strikes N.Y. Budget","https://www.nytimes.com/2020/04/02/nyregion/coronavirus-ny-state-budget.html"
"1662",2020-04-25,"‘There Are No Viruses Here’: Leader of Belarus Scoffs at Lockdowns","https://www.nytimes.com/2020/04/25/world/europe/belarus-lukashenko-coronavirus.html"
"1663",2020-04-22,"With Selective Coronavirus Coverage, China Builds a Culture of Hate","https://www.nytimes.com/2020/04/22/business/china-coronavirus-propaganda.html"
"1664",2020-03-16,"Macron Declares France ‘at War’ With Virus, as E.U. Proposes 30-Day Travel Ban","https://www.nytimes.com/2020/03/16/world/europe/coronavirus-france-macron-travel-ban.html"
"1665",2020-04-08,"Pharmaceutical Profits and Public Health Are Not Incompatible","https://www.nytimes.com/2020/04/08/opinion/coronavirus-drug-company-profits.html"
"1666",2020-04-18,"The Food Chain’s Weakest Link: Slaughterhouses","https://www.nytimes.com/2020/04/18/business/coronavirus-meat-slaughterhouses.html"
"1667",2020-03-13,"Their School Is Open. But the Kids Are Staying Home.","https://www.nytimes.com/2020/03/13/parenting/school-closings-coronavirus.html"
"1668",2020-04-02,"The Racial Time Bomb in the Covid-19 Crisis","https://www.nytimes.com/2020/04/01/opinion/coronavirus-black-people.html"
"1669",2020-03-19,"After Mounting Criticism, Tesla Will Shut Down California Factory","https://www.nytimes.com/2020/03/19/business/tesla-fremont-factory-coronavirus.html"
"1670",2020-04-29,"What You Need to Know About the Covid-19 Antibody Test","https://www.nytimes.com/article/antibody-test-coronavirus.html"
"1671",2020-04-24,"'Disappointing' Week of Divorce Talks Between EU and Britain","https://www.nytimes.com/aponline/2020/04/24/business/ap-eu-brexit.html"
"1672",2020-04-22,"Tantrums Over? Spain Approves Lockdown Extension but Will Let Children Out","https://www.nytimes.com/reuters/2020/04/22/world/europe/22reuters-health-coronavirus-spain.html"
"1673",2020-02-11,"Some Experts Worry as a Germ-Phobic Trump Confronts a Growing Epidemic","https://www.nytimes.com/2020/02/10/us/politics/trump-coronavirus-epidemic.html"
"1674",2020-04-27,"‘Possible Covid’: Why the Lulls Never Last for Weary E.M.S. Crews","https://www.nytimes.com/2020/04/27/nyregion/fdny-coronavirus-paramedics.html"
"1675",2020-04-25,"Trump Suggests Daily Briefings No Longer Worth His Time as White House Considers Replacing Health Secretary","https://www.nytimes.com/2020/04/25/us/coronavirus-news.html"
"1676",2020-03-25,"Trump Wants U.S. ‘Opened Up’ by Easter, Despite Health Officials’ Warnings","https://www.nytimes.com/2020/03/24/us/politics/trump-coronavirus-easter.html"
"1677",2020-03-06,"Bonds Hit Historic Lows, Prompting Fed to Ponder: What More Can We Do?","https://www.nytimes.com/2020/03/06/business/economy/fed-coronavirus-rate-cut-limited-ammunition.html"
"1678",2020-03-02,"Your Monday Briefing","https://www.nytimes.com/2020/03/01/briefing/coronavirus-italy-india.html"
"1679",2020-04-21,"Uganda Detains Prominent Journalist for 'Subversive' Activities","https://www.nytimes.com/reuters/2020/04/21/world/africa/21reuters-uganda-rights.html"
"1680",2020-04-22,"As Leaders Urge Face Masks, Their Behavior Muffles the Message","https://www.nytimes.com/2020/04/22/us/politics/coronavirus-masks.html"
