"","created_time","headline","web_url"
"1",2020-03-15,"A Complete List of Trump’s Attempts to Play Down Coronavirus","https://www.nytimes.com/2020/03/15/opinion/trump-coronavirus.html"
"2",2020-03-06,"As Coronavirus Spreads, How You Can Protect a Family Member in a Nursing Home","https://www.nytimes.com/2020/03/06/us/nursing-home-coronavirus-deaths.html"
"3",2020-03-04,"Nursing Homes Are Starkly Vulnerable to Coronavirus","https://www.nytimes.com/2020/03/04/health/coronavirus-nursing-homes.html"
"4",2020-03-02,"Outbreak Strikes Seattle Area as Testing Is Scrutinized","https://www.nytimes.com/2020/03/02/world/coronavirus-updates-news-covid-19.html"
"5",2020-02-27,"Iran Vice President Is One of 7 Officials to Contract Coronavirus","https://www.nytimes.com/2020/02/27/world/middleeast/coronavirus-iran-vice-president.html"
"6",2020-02-27,"Germany Tries to Solve a Coronavirus Puzzle With ‘Endless Pieces’","https://www.nytimes.com/2020/02/27/world/europe/germany-coronavirus.html"
"7",2020-02-21,"Coronavirus Cases in the United States Reach 34, and More Are Expected","https://www.nytimes.com/2020/02/21/health/coronavirus-cases-usa.html"
"8",2020-02-13,"How the Coronavirus Pandemic Unfolded: a Timeline","https://www.nytimes.com/article/coronavirus-timeline.html"
"9",2020-02-13,"An American in a Locked Down Chinese Town: ‘Everyone Here Is So Bored’","https://www.nytimes.com/2020/02/13/world/asia/china-coronavirus-american.html"
"10",2020-02-11,"The Illness Now Has a Name, COVID-19","https://www.nytimes.com/2020/02/11/world/asia/coronavirus-china.html"
"11",2020-02-03,"Hong Kong Reports First Death From Coronavirus Outbreak","https://www.nytimes.com/2020/02/03/world/asia/coronavirus-china.html"
"12",2020-04-24,"Philippines' Coronavirus Infections Top 7,000","https://www.nytimes.com/reuters/2020/04/24/world/asia/24reuters-health-coronavirus-philippines-cases.html"
"13",2020-04-28,"Philippines Nears 8,000 Coronavirus Infections","https://www.nytimes.com/reuters/2020/04/28/world/asia/28reuters-health-coronavirus-philippines-cases.html"
"14",2020-04-22,"China to Focus on Clusters of Coronavirus Infections in Hospitals","https://www.nytimes.com/reuters/2020/04/22/world/asia/22reuters-health-coronavirus-china-li.html"
"15",2020-04-24,"Singapore Records 897 New Coronavirus Infections","https://www.nytimes.com/reuters/2020/04/24/world/asia/24reuters-health-coronavirus-singapore.html"
"16",2020-04-29,"Philippines' Coronavirus Infections Breach 8,000 Mark","https://www.nytimes.com/reuters/2020/04/29/world/asia/29reuters-health-coronavirus-philippines-cases.html"
"17",2020-02-20,"South Korea Confirms a Jump in Coronavirus Infections","https://www.nytimes.com/2020/02/20/world/asia/china-coronavirus.html"
"18",2020-04-21,"Coronavirus Infections May Not Be Uncommon, Tests Suggest","https://www.nytimes.com/2020/04/21/health/coronavirus-antibodies-california.html"
"19",2020-04-30,"Indonesia Says Coronavirus Infections Rise Above 10,000","https://www.nytimes.com/reuters/2020/04/30/world/asia/30reuters-health-coronavirus-indonesia-cases.html"
"20",2020-04-22,"Indonesia Reports 283 New Coronavirus Infections, 19 Deaths","https://www.nytimes.com/reuters/2020/04/22/world/asia/22reuters-health-coronavirus-indonesia-cases.html"
"21",2020-04-21,"Indonesia Reports 375 New Coronavirus Infections, 26 Deaths","https://www.nytimes.com/reuters/2020/04/21/world/asia/21reuters-health-coronavirus-indonesia-cases.html"
"22",2020-04-26,"Mexico Coronavirus Infections Rise to 13,842 Cases and 1,305 Deaths","https://www.nytimes.com/reuters/2020/04/25/world/americas/25reuters-health-coronavirus-mexico.html"
"23",2020-04-30,"Mexico Coronavirus Infections Rise to 17,799 Cases and 1,732 Deaths","https://www.nytimes.com/reuters/2020/04/29/world/americas/29reuters-health-coronavirus-mexico.html"
"24",2020-04-27,"Mexico Coronavirus Infections Rise to 14,677 Cases and 1,351 Deaths","https://www.nytimes.com/reuters/2020/04/26/world/americas/26reuters-health-coronavirus-mexico.html"
"25",2020-04-27,"Indonesia Reports 214 New Coronavirus Infections, 22 Deaths","https://www.nytimes.com/reuters/2020/04/27/world/asia/27reuters-health-coronavirus-indonesia-cases.html"
"26",2020-04-21,"Exporting Coronavirus? Infections Among U.S. Deportees Reach Haiti, Mexico","https://www.nytimes.com/reuters/2020/04/20/world/americas/20reuters-health-coronavirus-usa-deportees.html"
"27",2020-04-21,"Coronavirus Infections Rate Among Philippine Health Workers 'Worrisome': WHO Expert","https://www.nytimes.com/reuters/2020/04/20/world/asia/20reuters-health-coornavirus-who-asiapac-philippines.html"
"28",2020-04-04,"Brace Yourself for Waves of Coronavirus Infections","https://www.nytimes.com/2020/04/04/opinion/sunday/covid-whats-next.html"
"29",2020-04-24,"Up to One in 10 Residents of Moscow May Have Had Coronavirus Infections: Laboratory","https://www.nytimes.com/reuters/2020/04/24/world/europe/24reuters-health-coronavirus-russia-antibodies.html"
"30",2020-04-28,"Germans Urged to Stay Home as Coronavirus Infection Rate Edges Back Up","https://www.nytimes.com/reuters/2020/04/28/world/europe/28reuters-health-coronavirus-germany-institute.html"
"31",2020-04-29,"Lesson of the Day: ‘Black Americans Face Alarming Rates of Coronavirus Infection in Some States’","https://www.nytimes.com/2020/04/29/learning/lesson-of-the-day-black-americans-face-alarming-rates-of-coronavirus-infection-in-some-states.html"
"32",2020-03-22,"Lost Sense of Smell May Be Peculiar Clue to Coronavirus Infection","https://www.nytimes.com/2020/03/22/health/coronavirus-symptoms-smell-taste.html"
"33",2020-02-16,"Coronavirus Infection Found After Cruise Ship Passengers Disperse","https://www.nytimes.com/2020/02/16/world/asia/coronavirus-cruise-americans.html"
"34",2020-04-07,"Black Americans Face Alarming Rates of Coronavirus Infection in Some States","https://www.nytimes.com/2020/04/07/us/coronavirus-race.html"
"35",2020-02-24,"Westerdam Passengers at Low Risk of Coronavirus Infection, C.D.C. Says","https://www.nytimes.com/2020/02/24/health/coronavirus-westerdam-cdc.html"
"36",2020-03-30,"Restrictions Are Slowing Coronavirus Infections, New Data Suggest","https://www.nytimes.com/2020/03/30/health/coronavirus-restrictions-fevers.html"
"37",2020-04-13,"Who Is Immune to the Coronavirus?","https://www.nytimes.com/2020/04/13/opinion/coronavirus-immunity.html"
"38",2020-04-25,"Philippines Records 17 New Coronavirus Deaths, 102 More Infections","https://www.nytimes.com/reuters/2020/04/25/world/asia/25reuters-health-coronavirus-philippines-cases.html"
"39",2020-04-21,"Philippines Reports Nine New Coronavirus Deaths, 140 More Infections","https://www.nytimes.com/reuters/2020/04/21/world/asia/21reuters-health-coronavirus-philippines-cases.html"
"40",2020-02-29,"They Recovered From the Coronavirus. Were They Infected Again?","https://www.nytimes.com/2020/02/29/health/coronavirus-reinfection.html"
"41",2020-04-29,"Pakistan Prepares to Ease Coronavirus Curbs With Infections Below Projections","https://www.nytimes.com/reuters/2020/04/29/world/asia/29reuters-health-coronavirus-pakistan.html"
"42",2020-03-16,"Coronavirus Is Hiding in Plain Sight","https://www.nytimes.com/2020/03/16/health/coronavirus-statistics-undetected.html"
"43",2020-04-01,"These Coronavirus Exposures Might Be the Most Dangerous","https://www.nytimes.com/2020/04/01/opinion/coronavirus-viral-dose.html"
"44",2020-04-29,"Trump Hails U.S. Coronavirus Testing as Infections Cross a Million","https://www.nytimes.com/reuters/2020/04/29/us/politics/29reuters-health-coronavirus-usa-trump.html"
"45",2020-04-02,"Your Nose Itches. Is It Allergies, Flu or the Coronavirus?","https://www.nytimes.com/article/coronavirus-allergies-flu.html"
"46",2020-04-25,"Tokyo Confirms 103 New Coronavirus Cases on Saturday: Kyodo","https://www.nytimes.com/reuters/2020/04/25/world/asia/25reuters-health-coronavirus-tokyo.html"
"47",2020-03-27,"How Does the Coronavirus Compare With the Flu?","https://www.nytimes.com/article/coronavirus-vs-flu.html"
"48",2020-03-18,"From Flattening the Curve to Pandemic: A Coronavirus Glossary","https://www.nytimes.com/2020/03/18/us/coronavirus-terms-glossary.html"
"49",2020-03-31,"Infected but Feeling Fine: The Unwitting Coronavirus Spreaders","https://www.nytimes.com/2020/03/31/health/coronavirus-asymptomatic-transmission.html"
"50",2020-04-21,"Germany's Confirmed Coronavirus Cases Rise by 1,785 to 143,457: RKI","https://www.nytimes.com/reuters/2020/04/21/world/europe/21reuters-health-coronavirus-germany-cases.html"
"51",2020-03-17,"Is Ibuprofen Really Risky for Coronavirus Patients?","https://www.nytimes.com/2020/03/17/health/coronavirus-ibuprofen.html"
"52",2020-04-25,"Germany's Confirmed Coronavirus Cases Rise by 2,055 to 152,438: RKI","https://www.nytimes.com/reuters/2020/04/25/world/europe/25reuters-health-coronavirus-germany-cases.html"
"53",2020-04-02,"7 Ways to Explore the Math of the Coronavirus Using The New York Times","https://www.nytimes.com/2020/04/02/learning/7-ways-to-explore-the-math-of-the-coronavirus-using-the-new-york-times.html"
"54",2020-03-29,"Gargling for Coronavirus? What Science Can Tell Us","https://www.nytimes.com/2020/03/29/well/live/gargle-gargling-coronavirus-infections-bacteria-virus.html"
"55",2020-04-24,"Coronavirus and COVID-19: Fact Versus Fiction","https://www.nytimes.com/reuters/2020/04/24/us/24reuters-health-coronavirus-fiction.html"
"56",2020-04-13,"Despite Qualms, Arthritis Drug Is to Be Tested in Coronavirus Study","https://www.nytimes.com/2020/04/13/health/coronavirus-arthritis-drug-baricitinib.html"
"57",2020-04-24,"Germany's Confirmed Coronavirus Cases Rise by 2,337 to 150,383: RKI","https://www.nytimes.com/reuters/2020/04/24/world/europe/24reuters-health-coronavirus-germany-cases.html"
"58",2020-04-28,"Singapore Confirms 528 New Coronavirus Cases","https://www.nytimes.com/reuters/2020/04/28/world/asia/28reuters-health-coronavirus-singapore-cases.html"
"59",2020-04-21,"Don’t Think You Need a Coronavirus Test? What if I Paid You?","https://www.nytimes.com/2020/04/21/business/economy/coronavirus-tests-infections.html"
"60",2020-02-10,"Lessons That Go Beyond the Coronavirus Outbreak","https://www.nytimes.com/2020/02/10/upshot/coronavirus-risk-prevention-advice.html"
"61",2020-02-27,"C.D.C. Confirms First Possible Community Transmission of Coronavirus in U.S.","https://www.nytimes.com/2020/02/26/health/coronavirus-cdc-usa.html"
"62",2020-04-24,"Explainer: Could Warmer Weather Help Contain the Coronavirus?","https://www.nytimes.com/reuters/2020/04/24/world/asia/24reuters-health-coronavirus-seasonality-explainer.html"
"63",2020-03-30,"Coronavirus and Sex: Questions and Answers","https://www.nytimes.com/2020/03/30/style/sex-coronavirus-questions-answers.html"
"64",2020-04-30,"Factbox: Latest on the Worldwide Spread of the New Coronavirus","https://www.nytimes.com/reuters/2020/04/30/world/asia/30reuters-health-coronavirus-latest-factbox.html"
"65",2020-04-25,"Latest on the Spread of the Coronavirus Around the World","https://www.nytimes.com/reuters/2020/04/25/world/asia/25reuters-health-coronavirus-latest-factbox.html"
"66",2020-04-29,"Latest on the Spread of the Coronavirus Around the World","https://www.nytimes.com/reuters/2020/04/29/world/asia/29reuters-health-coronavirus-latest-factbox.html"
"67",2020-04-02,"F.D.A. Approves First Coronavirus Antibody Test in U.S.","https://www.nytimes.com/2020/04/02/health/coronavirus-antibody-test.html"
"68",2020-04-28,"Factbox: Latest on the Spread of the Coronavirus Around the World","https://www.nytimes.com/reuters/2020/04/28/world/asia/28reuters-health-coronavirus-latest-factbox.html"
"69",2020-03-11,"What Does the Coronavirus Do to the Body?","https://www.nytimes.com/article/coronavirus-body-symptoms.html"
"70",2020-03-12,"Coronavirus Threatens Americans With Underlying Conditions","https://www.nytimes.com/2020/03/12/health/coronavirus-midlife-conditions.html"
"71",2020-04-27,"Singapore Confirms 799 New Coronavirus Cases","https://www.nytimes.com/reuters/2020/04/27/world/asia/27reuters-health-coronavirus-singapore.html"
"72",2020-04-20,"Singapore Seemed to Have Coronavirus Under Control, Until Cases Doubled","https://www.nytimes.com/2020/04/20/world/asia/coronavirus-singapore.html"
"73",2020-02-28,"Confusion and Contradiction Reign in Iran’s Coronavirus Reporting","https://www.nytimes.com/2020/02/28/world/middleeast/coronavirus-iran-confusion.html"
"74",2020-04-28,"Thailand's Coronavirus Medics Feel Strain Even as Cases Decline","https://www.nytimes.com/reuters/2020/04/28/world/asia/28reuters-health-coronavirus-thailand-icu.html"
"75",2020-04-23,"Germany's Confirmed Coronavirus Cases Rise by 2,352 to 148,046: RKI","https://www.nytimes.com/reuters/2020/04/23/world/europe/23reuters-health-coronavirus-germany-cases.html"
"76",2020-04-23,"French Coronavirus Death Toll Close to 22,000: Ministry","https://www.nytimes.com/reuters/2020/04/23/world/europe/23reuters-health-coronavirus-france-casualties.html"
"77",2020-04-21,"Singapore Challenged by Coronavirus, but Has System to Handle It: WHO","https://www.nytimes.com/reuters/2020/04/21/world/asia/20reuters-health-coronavirus-who-asiapac-singapore.html"
"78",2020-03-23,"Mexico, the Coronavirus and the Hugging President","https://www.nytimes.com/2020/03/23/opinion/mexico-coronavirus-amlo.html"
"79",2020-03-17,"What Parents Need to Know About Coronavirus","https://www.nytimes.com/2020/03/17/parenting/coronavirus-children-pregnant-women.html"
"80",2020-04-21,"Singapore Challenged by Coronavirus, but Has System to Handle It: WHO","https://www.nytimes.com/reuters/2020/04/21/world/asia/21reuters-health-coronavirus-who-asiapac-singapore.html"
"81",2020-04-29,"Hungary Eases Coronavirus Restrictions Outside Budapest","https://www.nytimes.com/reuters/2020/04/29/world/europe/29reuters-health-coronavirus-hungary-easing.html"
"82",2020-03-25,"Can You Become Immune to the Coronavirus?","https://www.nytimes.com/2020/03/25/health/coronavirus-immunity-antibodies.html"
"83",2020-04-29,"Germany Expects Record Recession in 2020 Because of Coronavirus","https://www.nytimes.com/reuters/2020/04/29/world/europe/29reuters-health-coronavirus-germany-economy.html"
"84",2020-04-21,"Singapore Reports 1,111 New Coronavirus Cases","https://www.nytimes.com/reuters/2020/04/21/world/asia/21reuters-health-coronavirus-singapore.html"
"85",2020-04-30,"Denmark Says Coronavirus Spread Has Not Accelerated Since Reopening Began","https://www.nytimes.com/reuters/2020/04/30/world/europe/30reuters-health-coronavirus-denmark.html"
"86",2020-04-03,"Can an Old Vaccine Stop the New Coronavirus?","https://www.nytimes.com/2020/04/03/health/coronavirus-bcg-vaccine.html"
"87",2020-03-13,"I Practiced Social Distancing Before Coronavirus. It Works.","https://www.nytimes.com/2020/03/13/parenting/social-distancing-coronavirus.html"
"88",2020-04-21,"Vietnam's Leadership, Public Showing Strong Response to Contain Coronavirus: WHO","https://www.nytimes.com/reuters/2020/04/21/world/asia/21reuters-health-coronavirus-who-asiapac-vietnam.html"
"89",2020-04-27,"Miraca Unit Seeks Approval for Japan's First Coronavirus Antigen Tests","https://www.nytimes.com/reuters/2020/04/27/world/asia/27reuters-health-coronavirus-japan-test.html"
"90",2020-02-29,"U.S. Plans ‘Radical Expansion’ of Coronavirus Testing","https://www.nytimes.com/2020/02/29/health/fda-coronavirus-testing.html"
"91",2020-04-22,"Japanese Children's Home Reports Eight Babies With Coronavirus","https://www.nytimes.com/reuters/2020/04/22/world/asia/22reuters-health-coronavirus-japan-orphanage.html"
"92",2020-03-11,"For Italians, Dodging Coronavirus Has Become a Game of Chance","https://www.nytimes.com/2020/03/11/world/europe/italy-coronavirus.html"
"93",2020-04-22,"Japan Reports 14 More Coronavirus Cases on Italian Cruise Ship","https://www.nytimes.com/reuters/2020/04/22/world/asia/22reuters-health-coronavirus-japan-ship.html"
"94",2020-04-23,"Egypt Loosening Some Lockdown Restrictions for Ramadan; Coronavirus Toll Rises","https://www.nytimes.com/reuters/2020/04/23/world/middleeast/23reuters-health-coronavirus-egypt.html"
"95",2020-04-22,"Philippines Records Nine New Coronavirus Deaths, 111 More Cases","https://www.nytimes.com/reuters/2020/04/22/world/asia/22reuters-health-coronavirus-philippines-cases.html"
"96",2020-03-13,"Lesson of the Day: ‘How Coronavirus Hijacks Your Cells’","https://www.nytimes.com/2020/03/13/learning/lesson-of-the-day-how-coronavirus-hijacks-your-cells.html"
"97",2020-04-21,"Factbox: Latest on the Spread of the Coronavirus Around the World","https://www.nytimes.com/reuters/2020/04/21/world/asia/21reuters-health-coronavirus-latest-factbox.html"
"98",2020-04-29,"Thailand Reports Nine New Coronavirus Cases, No More Deaths","https://www.nytimes.com/reuters/2020/04/29/world/asia/29reuters-health-coronavirus-thailand-cases.html"
"99",2020-04-21,"Russia's Confirmed Coronavirus Cases Surge Past 52,000","https://www.nytimes.com/reuters/2020/04/21/world/europe/21reuters-health-coronavirus-russia-cases.html"
"100",2020-03-02,"How Are You Coping With the Coronavirus?","https://www.nytimes.com/2020/03/02/reader-center/coronavirus-coping.html"
"101",2020-03-19,"China Hits a Coronavirus Milestone: No New Local Infections","https://www.nytimes.com/2020/03/18/world/asia/china-coronavirus-zero-infections.html"
"102",2020-04-29,"The Last Places on Earth Without the Coronavirus","https://www.nytimes.com/reuters/2020/04/29/world/asia/29reuters-health-coronavirus-countries-graphic.html"
"103",2020-04-13,"Did I Have the Coronavirus?","https://www.nytimes.com/2020/04/13/opinion/coronavirus-antibodies-test.html"
"104",2020-04-25,"Singapore Reports 618 New Coronavirus Cases, Taking Total to 12,693","https://www.nytimes.com/reuters/2020/04/25/world/asia/25reuters-health-coronavirus-singapore.html"
"105",2020-04-24,"Philippines Extends Capital's Coronavirus Lockdown to May 15","https://www.nytimes.com/reuters/2020/04/23/world/asia/23reuters-health-coronavirus-philippines-lockdown.html"
"106",2020-03-08,"In U.S., Cases of Coronavirus Cross 500, and Deaths Rise to 22","https://www.nytimes.com/2020/03/08/world/coronavirus-news.html"
"107",2020-03-14,"These Lab Animals Will Help Fight Coronavirus","https://www.nytimes.com/2020/03/14/science/animals-coronavirus-vaccine.html"
"108",2020-04-23,"Coronavirus Spreads Easily in U.S. Homeless Shelters, CDC Says","https://www.nytimes.com/reuters/2020/04/23/us/23reuters-health-coronavirus-usa-homelessness.html"
"109",2020-04-23,"Philippines Nears 7,000 Coronavirus Cases, Reports 16 New Deaths","https://www.nytimes.com/reuters/2020/04/23/world/asia/23reuters-health-coronavirus-philippines-cases.html"
"110",2020-04-22,"Next BOJ Meeting to Be Shortened to Prevent Virus Infections: NHK","https://www.nytimes.com/reuters/2020/04/22/world/asia/22reuters-health-coronavirus-boj.html"
"111",2020-04-23,"Ecuador's Coronavirus Case Total Is Twice as High as Confirmed: Minister","https://www.nytimes.com/reuters/2020/04/23/world/americas/23reuters-health-coronavirus-ecuador.html"
"112",2020-04-27,"Iran, China Emphasize Cooperation in Coronavirus Battle- Iran Presidency","https://www.nytimes.com/reuters/2020/04/27/world/middleeast/27reuters-health-coronavirus-iran.html"
"113",2020-02-05,"Even Without Symptoms, Wuhan Coronavirus May Spread, Experts Fear","https://www.nytimes.com/2020/02/04/health/coronavirus-symptoms-germany.html"
"114",2020-04-01,"The Coronavirus Patients Betrayed by Their Own Immune Systems","https://www.nytimes.com/2020/04/01/health/coronavirus-cytokine-storm-immune-system.html"
"115",2020-04-22,"Coronavirus Spreads Easily in U.S. Homeless Shelters, CDC Says","https://www.nytimes.com/reuters/2020/04/22/us/22reuters-health-coronavirus-usa-homelessness.html"
"116",2020-04-27,"Costa Rica to Start Reopening Economy May 1 as Infection Rate Slows","https://www.nytimes.com/reuters/2020/04/27/world/americas/27reuters-health-coronavirus-costa-rica.html"
"117",2020-04-23,"Tokyo Launches Coronavirus Drive-Through Tests as Crisis Deepens","https://www.nytimes.com/reuters/2020/04/23/world/asia/23reuters-health-coronavirus-japan-testing.html"
"118",2020-03-27,"A Heart Attack? No, It Was the Coronavirus","https://www.nytimes.com/2020/03/27/health/coronavirus-cardiac-heart-attacks.html"
"119",2020-02-05,"Why the New Coronavirus (Mostly) Spares Children","https://www.nytimes.com/2020/02/05/health/coronavirus-children.html"
"120",2020-04-05,"Alexa, Do I Have Coronavirus?","https://www.nytimes.com/2020/04/05/opinion/coronavirus-testing-smart-home.html"
"121",2020-04-26,"Chile to Push Ahead With Coronavirus 'Release Certificates' Despite WHO Warning","https://www.nytimes.com/reuters/2020/04/26/world/americas/26reuters-health-coronavirus-chile.html"
"122",2020-04-30,"On Coronavirus ICU Front Line: A Thai Nurse's Story","https://www.nytimes.com/reuters/2020/04/30/world/asia/30reuters-health-coronavirus-thailand-nurse.html"
"123",2020-04-02,"What Pregnant Women Should Know About Coronavirus","https://www.nytimes.com/article/pregnancy-coronavirus.html"
"124",2020-04-23,"Mexico Coronavirus Cases Top 10,000 as Sickly Economy Contracts","https://www.nytimes.com/reuters/2020/04/22/world/americas/22reuters-health-coronavirus-mexico-tally.html"
"125",2020-04-29,"Malaysia Reports 94 New Coronavirus Cases, No New Deaths","https://www.nytimes.com/reuters/2020/04/29/world/asia/29reuters-health-coronavirus-malaysia.html"
"126",2020-04-30,"Australia Plots Return of Sport as Spread of Coronavirus Slows","https://www.nytimes.com/reuters/2020/04/30/world/asia/30reuters-health-coronavirus-australia.html"
"127",2020-04-29,"India Has 1,000 Coronavirus Deaths but Expert Says No Exponential Rise","https://www.nytimes.com/reuters/2020/04/29/world/asia/29reuters-health-coronavirus-southasia.html"
"128",2020-04-26,"Tokyo Confirms 72 New Coronavirus Cases on Sunday: Kyodo","https://www.nytimes.com/reuters/2020/04/26/world/asia/26reuters-health-coronavirus-japan-toll.html"
"129",2020-04-29,"Australia Links Coronavirus Outbreak in Remote South to Carnival Corp Cruise Ship","https://www.nytimes.com/reuters/2020/04/29/world/asia/29reuters-health-coronavirus-australia.html"
"130",2020-04-22,"South Korea Finds Patients Testing Positive Post-Recovery From Coronavirus Barely Infectious","https://www.nytimes.com/reuters/2020/04/22/world/asia/22reuters-health-coronavirus-southkorea-relapse.html"
"131",2020-03-17,"Pregnant and Worried About Coronavirus? Experts Weigh In","https://www.nytimes.com/2020/04/06/parenting/coronavirus-pregnancy-questions.html"
"132",2020-04-26,"Singapore Reports 931 New Coronavirus Cases, Taking Total to 13,624","https://www.nytimes.com/reuters/2020/04/26/world/asia/26reuters-health-coronavirus-singapore.html"
"133",2020-03-22,"Warmer Weather May Slow, but Not Halt, Coronavirus","https://www.nytimes.com/2020/03/22/health/warm-weather-coronavirus.html"
"134",2020-04-22,"Singapore Reports 1,016 More Coronavirus Cases, 12th Death","https://www.nytimes.com/reuters/2020/04/22/world/asia/22reuters-health-coronavirus-singapore.html"
"135",2020-04-26,"Philippines' Coronavirus Death Toll Tops 500","https://www.nytimes.com/reuters/2020/04/26/world/asia/26reuters-health-coronavirus-philippines-cases.html"
"136",2020-04-21,"WHO Warns Lifting of Coronavirus Lockdowns Must Be Gradual","https://www.nytimes.com/reuters/2020/04/20/world/asia/20reuters-health-coronavirus-who-pacific.html"
"137",2020-03-11,"Why the U.S. Wasn’t Ready for the Coronavirus","https://www.nytimes.com/2020/03/11/podcasts/the-daily/coronavirus-us-testing.html"
"138",2020-04-27,"Dutch Kingsday Celebrations Muted by Coronavirus Lockdown","https://www.nytimes.com/reuters/2020/04/27/world/europe/27reuters-health-coronavirus-netherlands-kingsday.html"
"139",2020-03-27,"Shielding the Fetus From the Coronavirus","https://www.nytimes.com/2020/03/27/health/shielding-the-fetus-from-the-coronavirus.html"
"140",2020-04-30,"In Syria's Idlib City, a Caravan Spreads the Word About Coronavirus","https://www.nytimes.com/reuters/2020/04/30/world/middleeast/30reuters-health-coronvavirus-syria-campaign.html"
"141",2020-04-28,"Putin Extends Russia's Non-Working Period Due to Coronavirus Until May 11","https://www.nytimes.com/reuters/2020/04/28/world/europe/28reuters-health-coronavirus-russia.html"
"142",2020-04-25,"Malaysia Reports 51 New Coronavirus Cases, 2 Deaths","https://www.nytimes.com/reuters/2020/04/25/world/asia/25reuters-health-coronavirus-malaysia-cases.html"
"143",2020-04-26,"Latest on the Spread of the Coronavirus Around the World","https://www.nytimes.com/reuters/2020/04/26/world/asia/26reuters-health-coronavirus-latest-factbox.html"
"144",2020-02-25,"C.D.C. Officials Warn of Coronavirus Outbreaks in the U.S.","https://www.nytimes.com/2020/02/25/health/coronavirus-us.html"
"145",2020-04-30,"Panama Coronavirus Cases Climb to 6,378, Deaths Reach 178","https://www.nytimes.com/reuters/2020/04/29/world/americas/29reuters-health-coronavirus-panama.html"
"146",2020-04-26,"Malaysia Reports 38 New Coronavirus Cases, No New Deaths","https://www.nytimes.com/reuters/2020/04/26/world/asia/26reuters-health-coronavirus-malaysia.html"
"147",2020-03-06,"In the U.S., More Than 300 Coronavirus Cases Are Confirmed","https://www.nytimes.com/2020/03/06/world/coronavirus-news.html"
"148",2020-04-29,"Indonesia Announces 260 Coronavirus Cases, 11 Deaths","https://www.nytimes.com/reuters/2020/04/29/world/asia/29reuters-health-coronavirus-indonesia.html"
"149",2020-04-30,"Yemen Reports First Two Coronavirus Deaths, Braces for More","https://www.nytimes.com/reuters/2020/04/30/world/middleeast/30reuters-yemen-health-coronavirus.html"
"150",2020-04-26,"Panama Coronavirus Cases Advance to 5,779, Deaths Reach 165","https://www.nytimes.com/reuters/2020/04/26/world/americas/26reuters-health-coronavirus-panama.html"
"151",2020-04-24,"Answers to Questions About New Coronavirus Antibody Studies","https://www.nytimes.com/aponline/2020/04/24/health/ap-us-med-virus-outbreak-antibody-studies.html"
