"","created_time","headline","web_url"
"2146",2020-04-23,"Now Virtual and in Video, Museum Websites Shake Off the Dust","https://www.nytimes.com/2020/04/23/arts/design/best-virtual-museum-guides.html"
"2147",2020-04-11,"Murder Rates Were Staggering. The Virus Has Brought Some Quiet, for Now.","https://www.nytimes.com/2020/04/11/world/americas/coronavirus-murder-latin-america-crime.html"
"2148",2020-04-22,"The Untold Story of the Birth of Social Distancing","https://www.nytimes.com/2020/04/22/us/politics/social-distancing-coronavirus.html"
"2149",2020-04-24,"U.S. Food Banks Run Short on Staples as Hunger Soars","https://www.nytimes.com/reuters/2020/04/24/us/24reuters-health-coronavirus-foodbanks-insight.html"
"2150",2020-04-07,"Spain’s Coronavirus Crisis Accelerated as Warnings Went Unheeded","https://www.nytimes.com/2020/04/07/world/europe/spain-coronavirus.html"
"2151",2020-04-18,"10 African Countries Have No Ventilators. That’s Only Part of the Problem.","https://www.nytimes.com/2020/04/18/world/africa/africa-coronavirus-ventilators.html"
"2152",2020-03-29,"Trump Is Hurting His Own Re-election Chances","https://www.nytimes.com/2020/03/29/opinion/trump-coronavirus-election.html"
"2153",2020-04-15,"Shoulder-to-Shoulder, These Detroit Workers Have No Choice but to Ride the Bus","https://www.nytimes.com/2020/04/15/us/coronavirus-bus-detroit.html"
"2154",2020-02-24,"Is It a Pandemic Yet?","https://www.nytimes.com/2020/02/24/opinion/coronavirus-pandemic.html"
"2155",2020-04-24,"Exclusive: Trial of Gilead's Potential Coronavirus Treatment Running Ahead of Schedule, Researcher Says","https://www.nytimes.com/reuters/2020/04/24/us/24reuters-health-coronavirus-gilead-exclusive.html"
"2156",2020-04-08,"Wall Street Rallies as Investors Focus on the Recovery","https://www.nytimes.com/2020/04/08/business/live-stock-market-coronavirus.html"
"2157",2020-04-30,"U.S. Stocks Have Their Best Month Since 1987","https://www.nytimes.com/2020/04/30/business/stock-market-today-coronavirus.html"
"2158",2020-03-30,"Paul Theroux Recalls a Fear-Filled Lockdown","https://www.nytimes.com/2020/03/30/travel/coronavirus-travel-theroux-essay.html"
"2159",2020-03-15,"Ahead of the Pack, How Microsoft Told Workers to Stay Home","https://www.nytimes.com/2020/03/15/technology/microsoft-coronavirus-response.html"
"2160",2020-04-30,"Who Should Wear Masks on Planes? More Airlines Say Everyone","https://www.nytimes.com/2020/04/30/business/airlines-masks-coronavirus-passengers.html"
"2161",2020-04-15,"What Cancer Has Taught Me About Fear","https://www.nytimes.com/2020/04/15/well/live/cancer-lessons-on-fear.html"
"2162",2020-04-30,"Report: NBA Eyes Disney World, Encouraged by New Medicines","https://www.nytimes.com/reuters/2020/04/29/sports/basketball/29reuters-basketball-nba-disney-world-coronavirus.html"
"2163",2020-04-29,"Editorial Roundup: US","https://www.nytimes.com/aponline/2020/04/29/us/ap-us-editorial-rdp-.html"
"2164",2020-04-01,"N.B.A. Players Miss Other Sports Too","https://www.nytimes.com/2020/04/01/sports/basketball/coronavirus-nba-soccer.html"
"2165",2020-04-30,"The Heart of Britain’s Watch Revival","https://www.nytimes.com/2020/04/30/fashion/watches-britain-henley-on-thames-bremont.html"
"2166",2020-04-24,"A Funeral, Reinvented for the Pandemic","https://www.nytimes.com/2020/04/24/podcasts/daily-newsletter-funerals-virus.html"
"2167",2020-04-17,"Alexandria Ocasio-Cortez on Progressivism and the Pandemic","https://www.nytimes.com/2020/04/17/podcasts/the-daily/alexandria-ocasio-cortez-coronavirus.html"
"2168",2020-04-21,"Pandemic’s Costs Stagger the Nursing Home Industry","https://www.nytimes.com/2020/04/21/business/coronavirus-nursing-home-finances.html"
"2169",2020-03-28,"The Lost Month: How a Failure to Test Blinded the U.S. to Covid-19","https://www.nytimes.com/2020/03/28/us/testing-coronavirus-pandemic.html"
"2170",2020-04-25,"Tux, Gown, Masks: Arab Couples Scramble to Marry During a Pandemic","https://www.nytimes.com/2020/04/25/world/middleeast/virus-weddings-arab.html"
"2171",2020-03-24,"Is Marijuana an ‘Essential’ Like Milk or Bread? Some States Say Yes","https://www.nytimes.com/article/coronavirus-weed-marijuana.html"
"2172",2020-04-04,"Doctors Need Room to Make the Wrenching Decisions They Face","https://www.nytimes.com/2020/04/04/opinion/coronavirus-doctors-lawsuits-prosecution.html"
"2173",2020-04-14,"U.S. Governors, at Center of Virus Response, Weigh What It Will Take to Reopen States","https://www.nytimes.com/2020/04/14/us/coronavirus-governors-trump.html"
"2174",2020-04-20,"The Next Year (or Two) of the Pandemic","https://www.nytimes.com/2020/04/20/podcasts/the-daily/coronavirus-how-long-lockdowns.html"
"2175",2020-04-22,"Coronavirus Circulated in U.S. Weeks Earlier Than Thought, Mistaken for Flu, Health Official Says","https://www.nytimes.com/reuters/2020/04/22/us/22reuters-health-coronavirus-usa-california.html"
"2176",2020-04-16,"Latinos Are Essential Workers. Will They Be Essential Voters?","https://www.nytimes.com/2020/04/16/us/politics/latinos-coronavirus-trump.html"
"2177",2020-03-09,"How Not to Get Sick While Traveling","https://www.nytimes.com/2020/03/09/travel/coronavirus-travel-sick.html"
"2178",2020-04-02,"What Students Are Saying About Public Preschool, Staying Healthy and Being Trapped Inside","https://www.nytimes.com/2020/04/02/learning/what-students-are-saying-about-public-preschool-staying-healthy-and-being-trapped-inside.html"
"2179",2020-04-13,"Economic Pain Will Persist Long After Lockdowns End","https://www.nytimes.com/2020/04/13/business/coronavirus-economy.html"
"2180",2020-04-23,"Gilead Disputes Report That Its Drug Flopped in Leaked Coronavirus Trial","https://www.nytimes.com/reuters/2020/04/23/world/asia/23reuters-health-coronavirus-gilead-sciences.html"
"2181",2020-04-03,"How to Navigate Public Spaces and More","https://www.nytimes.com/2020/04/03/style/etiquette-coronavirus.html"
"2182",2020-03-26,"Who Knew Grocery Shopping Could Be So Stressful?","https://www.nytimes.com/2020/03/26/well/eat/coronavirus-shopping-food-groceries-infection.html"
"2183",2020-03-26,"‘We’re in Disaster Mode’: Courage Inside a Brooklyn Hospital Confronting Coronavirus","https://www.nytimes.com/2020/03/26/nyregion/coronavirus-brooklyn-hospital.html"
"2184",2020-04-29,"Explainer: What Does New Data Say About Gilead's Experimental Coronavirus Drug?","https://www.nytimes.com/reuters/2020/04/29/us/29reuters-health-coronavirus-gilead-data-explainer.html"
"2185",2020-04-16,"U.S. Sends Funds to Needy Nations to Fight the Virus, but Maybe Not for Masks","https://www.nytimes.com/2020/04/16/us/politics/coronavirus-foreign-aid-protective-equipment.html"
"2186",2020-04-09,"OPEC Talks to Cut Oil Production Disappoint Traders","https://www.nytimes.com/2020/04/09/business/stock-market-today-coronavirus.html"
"2187",2020-04-21,"What Will Our New Normal Feel Like? Hints Are Beginning to Emerge","https://www.nytimes.com/2020/04/21/world/americas/coronavirus-social-impact.html"
"2188",2020-04-02,"Turning the Tables, Russia Sends Virus Aid to U.S.","https://www.nytimes.com/2020/04/02/world/europe/coronavirus-us-russia-aid.html"
"2189",2020-04-20,"New York Needed Ventilators. So They Developed One in a Month.","https://www.nytimes.com/2020/04/20/technology/new-york-ventilators-coronavirus.html"
"2190",2020-04-11,"Burning Man Falls Victim to Pandemic","https://www.nytimes.com/2020/04/11/arts/music/burning-man-canceled-coronavirus.html"
"2191",2020-03-24,"Man Fatally Poisons Himself While Self-Medicating for Coronavirus, Doctor Says","https://www.nytimes.com/2020/03/24/us/chloroquine-poisoning-coronavirus.html"
"2192",2020-04-06,"How a Ship’s Coronavirus Outbreak Became a Moral Crisis for the Military","https://www.nytimes.com/2020/04/06/us/politics/coronavirus-navy-secretary-roosevelt-crozier.html"
"2193",2020-04-28,"UK Retailers Cut Non-Food Prices by Most on Record: BRC","https://www.nytimes.com/reuters/2020/04/28/world/europe/28reuters-health-coronavirus-britain-inflation.html"
"2194",2020-04-13,"‘Worst Is Over,’ Cuomo Says as States Snub Trump on Restarting Economy","https://www.nytimes.com/2020/04/13/nyregion/new-york-coronavirus-reopen-plan.html"
"2195",2020-04-21,"U.S. Orders Chevron to Stop Producing Oil in Venezuela","https://www.nytimes.com/2020/04/21/business/live-stock-market-trading-coronavirus.html"
"2196",2020-04-04,"430,000 People Have Traveled From China to U.S. Since Coronavirus Surfaced","https://www.nytimes.com/2020/04/04/us/coronavirus-china-travel-restrictions.html"
"2197",2020-04-24,"Please Do Not Eat Disinfectant","https://www.nytimes.com/article/coronavirus-disinfectant-inject-ingest.html"
"2198",2020-03-24,"How Cuomo, Once on Sidelines, Became the Politician of the Moment","https://www.nytimes.com/2020/03/24/nyregion/governor-andrew-cuomo-coronavirus.html"
"2199",2020-04-29,"Worst Economy in a Decade. What’s Next? ‘Worst in Our Lifetime.’","https://www.nytimes.com/2020/04/29/business/economy/us-gdp.html"
"2200",2020-04-30,"Frustrated by Crowds, Coastal States Weigh What to Do About Beaches","https://www.nytimes.com/2020/04/30/us/newsom-beaches-california-coronavirus.html"
"2201",2020-04-26,"As States Push to Reopen, Business Leaders Say Not So Fast","https://www.nytimes.com/2020/04/26/business/coronavirus-states-businesses-reopen.html"
"2202",2020-04-29,"Remdesivir Shows Modest Benefits in Coronavirus Trial","https://www.nytimes.com/2020/04/29/health/gilead-remdesivir-coronavirus.html"
"2203",2020-04-28,"Despite Trump’s Nudging, Schools Are Likely to Stay Shut for Months","https://www.nytimes.com/2020/04/28/us/coronavirus-schools-reopen.html"
"2204",2020-04-20,"Two E.R. Workers Worry: If They Died, Who’d Take Care of Their Son?","https://www.nytimes.com/2020/04/20/nyregion/er-workers-hospitals-coronavirus.html"
"2205",2020-03-28,"Trump Backtracks After Cuomo Criticizes Quarantine Idea","https://www.nytimes.com/2020/03/28/nyregion/coronavirus-new-york-update.html"
"2206",2020-04-30,"Georgia Beer Named After Virus Expert Fauci Enjoys a 2nd Run","https://www.nytimes.com/aponline/2020/04/30/business/ap-us-virus-outbreak-fauci-beer.html"
"2207",2020-04-27,"After Beating Coronavirus, a Zimbabwe Survivor Lives With the Stigma","https://www.nytimes.com/reuters/2020/04/27/world/africa/27reuters-health-coronavirus-zimbabwe-survivor.html"
"2208",2020-04-24,"Wall Street Rallies, Bucking Drop in Global Stocks","https://www.nytimes.com/2020/04/24/business/stock-market-live-coronavirus.html"
"2209",2020-04-27,"Trump Says His Remarks on Using Disinfectant Inside People's Bodies Were Sarcastic","https://www.nytimes.com/reuters/2020/04/27/us/27reuters-health-coronavirus-trump-sarcastic.html"
"2210",2020-04-24,"Trump Says His Remarks on Using Disinfectant Inside People's Bodies Were Sarcastic","https://www.nytimes.com/reuters/2020/04/24/us/24reuters-health-coronavirus-trump-sarcastic.html"
"2211",2020-04-25,"Trump Says His Remarks on Using Disinfectant Inside People's Bodies Were Sarcastic","https://www.nytimes.com/reuters/2020/04/25/us/25reuters-health-coronavirus-trump-sarcastic.html"
"2212",2020-04-11,"How the Virus Crisis Could Help a Red-State Democrat Stay in Office","https://www.nytimes.com/2020/04/11/us/politics/coronavirus-governors-north-carolina-new-hampshire.html"
"2213",2020-04-06,"Trump Keeps Putting the Lives of Lupus Patients at Risk","https://www.nytimes.com/2020/04/06/opinion/coronavirus-hydroxychloroquine-lupus.html"
"2214",2020-04-21,"Turkish Economy to Shrink for First Time in a Decade This Year: Reuters Poll","https://www.nytimes.com/reuters/2020/04/21/world/europe/21reuters-turkey-economy-poll.html"
"2215",2020-03-19,"Before Virus Outbreak, a Cascade of Warnings Went Unheeded","https://www.nytimes.com/2020/03/19/us/politics/trump-coronavirus-outbreak.html"
"2216",2020-03-10,"N.Y. Creates ‘Containment Zone’ Limiting Large Gatherings in New Rochelle","https://www.nytimes.com/2020/03/10/nyregion/coronavirus-new-york-update.html"
"2217",2020-04-16,"No Respite in Yemen War a Week After Saudi Cease-Fire Announced","https://www.nytimes.com/2020/04/16/world/middleeast/yemen-cease-fire-covid19.html"
"2218",2020-04-25,"Reopening Has Begun. No One Is Sure What Happens Next.","https://www.nytimes.com/2020/04/25/business/economy/coronavirus-economy-reopening.html"
"2219",2020-04-29,"Stocks Rally on Treatment Hopes, Currencies Await ECB","https://www.nytimes.com/reuters/2020/04/29/business/29reuters-global-markets.html"
"2220",2020-04-30,"Fauci Says Leak Concerns Fueled His White House Revelation of Gilead Drug Results","https://www.nytimes.com/reuters/2020/04/30/us/30reuters-health-coronavirus-gilead-fauci.html"
"2221",2020-04-29,"New Zealand's Ardern Spoke to Queen on Pandemic Response","https://www.nytimes.com/reuters/2020/04/29/world/asia/29reuters-health-coronavirus-newzealand-uk.html"
"2222",2020-04-15,"States Are in a Quandary as Taxes Evaporate and Virus Spending Soars","https://www.nytimes.com/2020/04/15/business/economy/state-tax-revenue-debt-coronavirus.html"
"2223",2020-04-24,"FDA Warns of Heart Risks With Trump-Promoted Malaria Drug","https://www.nytimes.com/aponline/2020/04/24/us/politics/ap-us-virus-outbreak-malaria-drugs.html"
"2224",2020-04-24,"No, Don't Inject Disinfectant: Outcry Over Trump's Musing","https://www.nytimes.com/aponline/2020/04/24/us/politics/ap-us-virus-outbreak-trump-therapies.html"
"2225",2020-04-22,"Argentina Doesn't Make Payment, Starting Default Countdown","https://www.nytimes.com/aponline/2020/04/22/business/ap-lt-argentina-debt.html"
"2226",2020-02-27,"We Knew Disease X Was Coming. It’s Here Now.","https://www.nytimes.com/2020/02/27/opinion/coronavirus-pandemics.html"
"2227",2020-04-18,"A Key G.O.P. Strategy: Blame China. But Trump Goes Off Message.","https://www.nytimes.com/2020/04/18/us/politics/trump-china-virus.html"
"2228",2020-04-16,"‘Nowhere to Hide’ as Unemployment Permeates the Economy","https://www.nytimes.com/2020/04/16/business/economy/unemployment-numbers-coronavirus.html"
"2229",2020-04-23,"Health Dept. Official Says Doubts on Hydroxychloroquine Led to His Ouster","https://www.nytimes.com/2020/04/22/us/politics/rick-bright-trump-hydroxychloroquine-coronavirus.html"
"2230",2020-04-24,"Trump Muses About Light as Remedy, but Also Disinfectant, Which Is Dangerous","https://www.nytimes.com/2020/04/24/health/sunlight-coronavirus-trump.html"
"2231",2020-04-22,"Canada Inflation Rate Tumbles to Near Five-Year Low as Gas Prices Slump","https://www.nytimes.com/reuters/2020/04/22/us/22reuters-canada-economy-inflation.html"
"2232",2020-04-07,"When Will There Be a Treatment for the Coronavirus?","https://www.nytimes.com/2020/04/07/opinion/coronavirus-treatment.html"
"2233",2020-04-09,"‘Sudden Black Hole’ for the Economy With Millions More Unemployed","https://www.nytimes.com/2020/04/09/business/economy/unemployment-claim-numbers-coronavirus.html"
"2234",2020-04-22,"Probe Sought in Trump Administration's Ouster of Scientist","https://www.nytimes.com/aponline/2020/04/22/business/ap-us-virus-outbreak-hhs-whistleblower.html"
"2235",2020-04-08,"For H.I.V. Survivors, a Feeling of Weary Déjà Vu","https://www.nytimes.com/2020/04/08/style/coronavirus-hiv.html"
"2236",2020-04-10,"Sex and the Coronavirus: Reader Questions, Answered","https://www.nytimes.com/2020/04/10/style/coronavirus-sex-pregnancy-questions.html"
"2237",2020-03-02,"Big Pharma May Pose an Obstacle to Vaccine Development","https://www.nytimes.com/2020/03/02/opinion/contributors/pharma-vaccines.html"
"2238",2020-04-07,"The Pandemic’s Missing Data","https://www.nytimes.com/2020/04/07/opinion/coronavirus-blacks.html"
"2239",2020-04-28,"New Research Says Players at Risk of Coronavirus Spread to Lungs","https://www.nytimes.com/reuters/2020/04/28/sports/soccer/28reuters-health-coronavirus-soccer.html"
"2240",2020-04-22,"U.S. Official Says He Was Ousted for Urging Caution on Trump-Touted Coronavirus Drug","https://www.nytimes.com/reuters/2020/04/22/us/22reuters-health-coronavirus-usa-bright.html"
"2241",2020-04-11,"He Could Have Seen What Was Coming: Behind Trump’s Failure on the Virus","https://www.nytimes.com/2020/04/11/us/politics/coronavirus-trump-response.html"
"2242",2020-04-27,"Stocks Rise as Oil Prices Plunge","https://www.nytimes.com/2020/04/27/business/coronavirus-stock-market-tracker.html"
"2243",2020-04-25,"Here’s How You Can Change Lives in the Pandemic","https://www.nytimes.com/2020/04/25/opinion/sunday/coronavirus-giving-guide.html"
"2244",2020-04-29,"Canadian Football League Asks for Financial Lifeline","https://www.nytimes.com/reuters/2020/04/29/sports/29reuters-health-coronavirus-cfl.html"
"2245",2020-04-21,"Factbox: German Companies Seek State Aid to Cope With Coronavirus","https://www.nytimes.com/reuters/2020/04/21/world/europe/21reuters-health-coronavirus-germany-companies-factbox.html"
"2246",2020-04-21,"Lockdown Protesters Would’ve Wanted Titanic to Sink Sooner, Kimmel Says","https://www.nytimes.com/2020/04/21/arts/television/coronavirus-lockdown-protesters.html"
"2247",2020-04-03,"What to Do if Your Day Care Is Still Open","https://www.nytimes.com/2020/04/03/parenting/coronavirus-day-care.html"
"2248",2020-04-27,"Peacocks and Vultures Are Circling the Deficit","https://www.nytimes.com/2020/04/27/opinion/republicans-deficits-coronavirus.html"
"2249",2020-04-16,"W.H.O., Now Trump’s Scapegoat, Warned About Coronavirus Early and Often","https://www.nytimes.com/2020/04/16/health/WHO-Trump-coronavirus.html"
"2250",2020-04-16,"Disposable N95 Masks Can Be Decontaminated, Researchers Confirm","https://www.nytimes.com/2020/04/16/health/n95-masks-decontaminated-coronavirus.html"
"2251",2020-04-29,"Powerful Meat Industry Holds More Sway After Trump’s Order","https://www.nytimes.com/2020/04/29/business/coronavirus-trump-meat-plants.html"
"2252",2020-04-30,"Crashing Economy, Rising Stocks: What’s Going On?","https://www.nytimes.com/2020/04/30/opinion/economy-stock-market-coronavirus.html"
"2253",2020-04-25,"Beaches Eyed as United States Takes Steps Toward Reopening","https://www.nytimes.com/reuters/2020/04/25/us/25reuters-health-coronavirus-usa.html"
"2254",2020-04-13,"Spain’s Lethal Secret: We Didn’t Have ‘the Best Health Care in the World’","https://www.nytimes.com/2020/04/13/opinion/spain-coronavirus-hospitals.html"
"2255",2020-04-09,"At the Center of a Storm: The Search for a Proven Coronavirus Treatment","https://www.nytimes.com/2020/04/09/health/coronavirus-remdesivir-kalil.html"
"2256",2020-03-20,"The Calculus of Coronavirus Care","https://www.nytimes.com/2020/03/20/well/live/coronavirus-covid-doctor-nurse-shortage-staff.html"
"2257",2020-04-26,"Trump Suggested ‘Injecting’ Disinfectant to Cure Coronavirus? We’re Not Surprised","https://www.nytimes.com/2020/04/26/opinion/coronavirus-bleach-trump-autism.html"
"2258",2020-03-15,"C.D.C. Gives New Guidelines, New York to Close Restaurants and Schools and Italian Deaths Rise","https://www.nytimes.com/2020/03/15/world/coronavirus-live.html"
"2259",2020-04-28,"Senate Republicans to Push Ahead on Judges Over Democratic Objections","https://www.nytimes.com/2020/04/28/us/politics/senate-republicans-judicial-nominees.html"
"2260",2020-04-22,"The Fear of Coronavirus and Flu Colliding in the Fall","https://www.nytimes.com/2020/04/22/health/coronavirus-flu-season-deaths.html"
"2261",2020-04-30,"Factbox: German Companies Seek State Aid to Cope With Coronavirus","https://www.nytimes.com/reuters/2020/04/30/world/europe/30reuters-health-coronavirus-germany-aid-factbox.html"
"2262",2020-04-30,"Britain's Sainsbury's Warns of $623 Million Coronavirus Hit to Profit","https://www.nytimes.com/reuters/2020/04/30/business/30reuters-sainsbury-s-results.html"
"2263",2020-04-09,"How to Write a Condolence Note","https://www.nytimes.com/2020/04/09/style/best-way-to-write-a-condolence-note-coronavirus.html"
"2264",2020-04-23,"Bezos, Musk Among Billionaires Gaining Net Worth in Pandemic: Report","https://www.nytimes.com/reuters/2020/04/23/business/23reuters-billionaires-coronavirus.html"
"2265",2020-04-18,"The Story of Remdesivir","https://www.nytimes.com/2020/04/17/opinion/remdesivir-coronavirus.html"
"2266",2020-04-29,"UN: New Polio Outbreak in Niger After Vaccination Suspended","https://www.nytimes.com/aponline/2020/04/29/world/africa/ap-af-virus-outbreak-niger-polio.html"
"2267",2020-04-22,"Trump Disagrees With Georgia's Push to Re-Open Economy","https://www.nytimes.com/reuters/2020/04/22/world/europe/22reuters-health-coronavirus-usa-georgia.html"
"2268",2020-04-28,"Oklahoma, Utah Face Scrutiny Over Malaria Drug Purchases","https://www.nytimes.com/aponline/2020/04/28/us/ap-us-virus-outbreak-malaria-drugs-states.html"
"2269",2020-03-27,"It’s Too Late to Avoid Disaster, but There Are Still Things We Can Do","https://www.nytimes.com/2020/03/27/opinion/coronavirus-trump-testing-shortages.html"
"2270",2020-03-09,"Some Hospitals Are Close to Running Out of Crucial Masks for Coronavirus","https://www.nytimes.com/2020/03/09/health/coronavirus-n95-face-masks.html"
"2271",2020-04-03,"What We Pretend to Know About the Coronavirus Could Kill Us","https://www.nytimes.com/2020/04/03/opinion/sunday/coronavirus-fake-news.html"
"2272",2020-04-14,"Trump Will Replace Fauci With First Fox News Guest He Sees, Colbert Says","https://www.nytimes.com/2020/04/14/arts/television/late-night-trump-fauci.html"
"2273",2020-04-08,"Summer Heat May Not Diminish Coronavirus Strength","https://www.nytimes.com/2020/04/08/health/coronavirus-summer-weather.html"
"2274",2020-03-30,"Zororo Makamba, 30, Dies; Zimbabwean Television Host","https://www.nytimes.com/2020/03/30/obituaries/zororo-makamba-30-dies-zimbabwean-television-host.html"
"2275",2020-03-23,"Scientists Identify 69 Drugs to Test Against the Coronavirus","https://www.nytimes.com/2020/03/22/science/coronavirus-drugs-chloroquine.html"
"2276",2020-04-11,"The ‘Red Dawn’ Emails: 8 Key Exchanges on the Faltering Response to the Coronavirus","https://www.nytimes.com/2020/04/11/us/politics/coronavirus-red-dawn-emails-trump.html"
"2277",2020-04-27,"Disinfectant Makers Steer Consumers Away From Trump's Coronavirus Comments","https://www.nytimes.com/reuters/2020/04/27/world/europe/27reuters-health-coronavirus-reckitt.html"
"2278",2020-04-21,"What the Negative Price of Oil Is Telling Us","https://www.nytimes.com/2020/04/21/upshot/negative-oil-price.html"
"2279",2020-04-07,"Why a California Lawmaker Is Pushing to Change Plasma Donation Rules","https://www.nytimes.com/2020/04/07/us/coronavirus-blood-plasma-donation.html"
"2280",2020-04-24,"Disinfectant Makers Steer Consumers Away From Trump's Coronavirus Comments","https://www.nytimes.com/reuters/2020/04/24/world/europe/24reuters-health-coronavirus-reckitt.html"
"2281",2020-04-30,"After Aggressive Mass Testing, Vietnam Says It Contains Coronavirus Outbreak","https://www.nytimes.com/reuters/2020/04/30/world/asia/30reuters-health-coronavirus-vietnam-fight-insight.html"
"2282",2020-04-22,"EU Regrets U.S. Refusal to Allow Economic Aid for Iran to Fight Coronavirus","https://www.nytimes.com/reuters/2020/04/22/world/middleeast/22reuters-health-coronavirus-iran-eu.html"
"2283",2020-03-12,"Lawrence Wright’s New Pandemic Novel Wasn’t Supposed to Be Prophetic","https://www.nytimes.com/2020/03/12/books/review/lawrence-wright-end-of-october-pandemic-novel-essay.html"
"2284",2020-04-14,"Answering Kids’ Questions About the Coronavirus, in Free Picture Books","https://www.nytimes.com/2020/04/14/books/coronavirus-picture-books.html"
"2285",2020-04-09,"Animal Viruses Are Jumping to Humans. Forest Loss Makes It Easier.","https://www.nytimes.com/2020/04/09/climate/animals-humans-virus-covid.html"
"2286",2020-04-24,"Fox Didn't Immediately Challenge Trump's Disinfectant Remark","https://www.nytimes.com/aponline/2020/04/24/us/ap-us-virus-outbreak-media.html"
"2287",2020-04-22,"Brexit's Back: Double-Whammy for Sterling After Virus Shock","https://www.nytimes.com/reuters/2020/04/22/business/22reuters-health-coronavirus-sterling.html"
"2288",2020-03-06,"With Coronavirus, ‘Health Care for Some’ Is a Recipe for Disaster","https://www.nytimes.com/2020/03/06/opinion/coronavirus-immigrants-health.html"
"2289",2020-04-17,"How San Francisco’s Chinatown Got Ahead of the Coronavirus","https://www.nytimes.com/2020/04/17/us/san-francisco-coronavirus-chinese-hospital.html"
"2290",2020-04-24,"Unions Denounce Las Vegas Mayor's Call to Re-Open Casinos","https://www.nytimes.com/reuters/2020/04/24/business/24reuters-health-coronavirus-lasvegas-unions.html"
"2291",2020-04-24,"NYSE Eyes Reopening Trading Floor, but Timeline Still Unclear","https://www.nytimes.com/reuters/2020/04/24/business/24reuters-health-coronavirus-nyse.html"
"2292",2020-04-24,"Coronavirus Prods Japan Agencies, Including Data Collectors, to Embrace Change","https://www.nytimes.com/reuters/2020/04/24/world/asia/24reuters-health-coronavirus-japan-data.html"
"2293",2020-03-18,"‘We’re Petrified’: Immigrants Afraid to Seek Medical Care for Coronavirus","https://www.nytimes.com/2020/03/18/us/coronavirus-immigrants.html"
"2294",2020-03-16,"An Epicenter of the Pandemic Will Be Jails and Prisons, if Inaction Continues","https://www.nytimes.com/2020/03/16/opinion/coronavirus-in-jails.html"
"2295",2020-03-11,"Bags Packed, Sanitizer on, Americans Travel as Coronavirus Worries Grow","https://www.nytimes.com/2020/03/11/us/airports-airlines-coronavirus.html"
"2296",2020-04-22,"A Cast Album I Love: ‘Twelfth Night’","https://www.nytimes.com/2020/04/22/theater/musical-cast-album-twelfth-night.html"
"2297",2020-04-21,"Political Wrangling, Controversy Mark Re-Opening of U.S. States","https://www.nytimes.com/reuters/2020/04/21/us/politics/21reuters-health-coronavirus-usa.html"
"2298",2020-04-16,"Someone Has Died. That’s When Their Job Begins.","https://www.nytimes.com/2020/04/16/opinion/coronavirus-funeral-directors.html"
